url,name,brand,sku,description,price,currency,availability,source,pid,images,product_details,breads,uniq_id,scraped_at
https://blinkit.com/prn/dongsuh-maxim-top-espresso-smoky-latte/prid/493455,Dongsuh Maxim TOP Espresso Smoky Latte,Dongsuh,493455,"The unique flavour of espresso is combined with the smoothness of milk to create the premium coffee known as T.O.P Master Latte. The coffee extract is made from premium Arabica beans that are carefully chosen, and it is balanced with milk and fresh cream to add softness and sweetness.",1,INR,OutOfStock,blinkit.com,493455,"https://cdn.grofers.com/cdn-cgi/image/f=auto,fit=scale-down,q=85,metadata=none,w=600,h=600/app/images/products/full_screen/pro_493455.jpg?ts=1685980065 | https://cdn.grofers.com/cdn-cgi/image/f=auto,fit=scale-down,q=85,metadata=none,w=600,h=600/app/images/products/sliding_image/493455a.jpg?ts=1690814743 | https://cdn.grofers.com/cdn-cgi/image/f=auto,fit=scale-down,q=85,metadata=none,w=600,h=600/app/images/products/sliding_image/493455b.jpg?ts=1690814743 | https://cdn.grofers.com/cdn-cgi/image/f=auto,fit=scale-down,q=85,metadata=none,w=600,h=600/app/images/products/sliding_image/493455c.jpg?ts=1690814743 | https://cdn.grofers.com/cdn-cgi/image/f=auto,fit=scale-down,q=85,metadata=none,w=600,h=600/app/images/products/sliding_image/493455d.jpg?ts=1690814743 | https://cdn.grofers.com/cdn-cgi/image/f=auto,fit=scale-down,q=85,metadata=none,w=600,h=600/app/images/products/sliding_image/493455e.jpg?ts=1690814743 | https://cdn.grofers.com/cdn-cgi/image/f=auto,fit=scale-down,q=85,metadata=none,w=600,h=600/app/images/products/common/customer_care.jpg","[{'Unit': '275 ml'}, {'Shelf Life': '12 months'}, {'FSSAI License': '10020011007350'}, {'Country of Origin': 'Korea'}, {'Customer Care Details': 'Email: info@blinkit.com'}, {'Return Policy': 'This Item is non-returnable. For a damaged, defective, incorrect or expired item, you can request a replacement within 72 hours of delivery. In case of an incorrect item, you may raise a replacement or return request only if the item is sealed/ unopened/ unused and in original condition.'}, {'Expiry Date': 'Please refer to the packaging of the product for expiry date.'}, {'Description': 'The unique flavour of espresso is combined with the smoothness of milk to create the premium coffee known as T.O.P Master Latte. The coffee extract is made from premium Arabica beans that are carefully chosen, and it is balanced with milk and fresh cream to add softness and sweetness.'}, {'Disclaimer': 'Quantity variations from the weight may occur, caused by loss or gain of moisture during the course of good distribution practices or by unavoidable reasons.'}]",,91135e0f-50e4-5432-ae26-610dc0d01992,19/11/2023 18:07:05
https://blinkit.com/prn/living-food-traditional-kala-khatta-soda-water/prid/500160,Living Food Traditional Kala Khatta Soda Water,Living Food,500160,Kala Khatta Soda is a perfect combination of concentrated natural jamun and lemon juice. Enjoy this fizzy soda as a refreshing beverage.,1,INR,OutOfStock,blinkit.com,500160,"https://cdn.grofers.com/cdn-cgi/image/f=auto,fit=scale-down,q=85,metadata=none,w=600,h=600/app/images/products/full_screen/pro_500160.jpg?ts=1685981753 | https://cdn.grofers.com/cdn-cgi/image/f=auto,fit=scale-down,q=85,metadata=none,w=600,h=600/app/images/products/sliding_image/500160a.jpg?ts=1690814612 | https://cdn.grofers.com/cdn-cgi/image/f=auto,fit=scale-down,q=85,metadata=none,w=600,h=600/app/images/products/sliding_image/500160b.jpg?ts=1690814612 | https://cdn.grofers.com/cdn-cgi/image/f=auto,fit=scale-down,q=85,metadata=none,w=600,h=600/app/images/products/sliding_image/500160c.jpg?ts=1690814612 | https://cdn.grofers.com/cdn-cgi/image/f=auto,fit=scale-down,q=85,metadata=none,w=600,h=600/app/images/products/sliding_image/500160d.jpg?ts=1690814612 | https://cdn.grofers.com/cdn-cgi/image/f=auto,fit=scale-down,q=85,metadata=none,w=600,h=600/app/images/products/common/customer_care.jpg","[{'Ingredients': 'Concentrated Natural Jamun & Lemon Juice, Cumin, Black Pepper, Sea Salt, Black Salt, Sugar and Water.'}, {'Unit': '250 ml'}, {'Nutrition Information': 'Amount per 100gEnergy (kcal) 42.32Carbohydrates (g) 10.43Protein (g) 0.15Total Fat (g) 0Total Sugar (g) 8.01Added Sugar (g) 4.06Trans Fat (g) 0Saturated Fat (g) 0Cholesterol (mg) 0Sodium (mg) 181.86'}, {'Shelf Life': '3 days'}, {'Manufacturer Details': 'LivingFoodCo Pvt. Ltd., 7th Mile Hosur Road, Kudlu Gate, Bengaluru, Karnataka-560068'}, {'Marketed By': 'LivingFoodCo Pvt. Ltd., 7th Mile Hosur Road, Kudlu Gate, Bengaluru, Karnataka-560068'}, {'FSSAI License': '11221334000363'}, {'Country of Origin': 'India'}, {'Customer Care Details': 'Email: info@blinkit.com'}, {'Return Policy': 'This Item is non-returnable. For a damaged, defective, incorrect or expired item, you can request a replacement within 72 hours of delivery. In case of an incorrect item, you may raise a replacement or return request only if the item is sealed/ unopened/ unused and in original condition.'}, {'Expiry Date': 'Please refer to the packaging of the product for expiry date.'}, {'Description': 'Kala Khatta Soda is a perfect combination of concentrated natural jamun and lemon juice. Enjoy this fizzy soda as a refreshing beverage.'}, {'Disclaimer': 'Every effort is made to maintain the accuracy of all information. However, actual product packaging and materials may contain more and/or different information. It is recommended not to solely rely on the information presented.'}]",,9ddbd5db-4ec9-5dce-8091-916585aa6d08,19/11/2023 18:07:05
https://blinkit.com/prn/nutologyst-nuts-seeds-mix/prid/457858,Nutologyst Nuts & Seeds Mix,Nutologyst,457858,"Nutologyst brings you the finest quality of jumbo dry fruits & trail mixes. These premium snacks are a tastier way to maintain a healthy lifestyle.
Relish the goodness of 100% natural ingredients with Nutologyst, your DRY FRUIT EXPERT.
",350,INR,OutOfStock,blinkit.com,457858,"https://cdn.grofers.com/cdn-cgi/image/f=auto,fit=scale-down,q=85,metadata=none,w=600,h=600/app/images/products/full_screen/pro_457858.jpg?ts=1685982179 | https://cdn.grofers.com/cdn-cgi/image/f=auto,fit=scale-down,q=85,metadata=none,w=600,h=600/app/images/products/sliding_image/457858a.jpg?ts=1687500592 | https://cdn.grofers.com/cdn-cgi/image/f=auto,fit=scale-down,q=85,metadata=none,w=600,h=600/app/images/products/sliding_image/457858b.jpg | https://cdn.grofers.com/cdn-cgi/image/f=auto,fit=scale-down,q=85,metadata=none,w=600,h=600/app/images/products/sliding_image/457858c.jpg | https://cdn.grofers.com/cdn-cgi/image/f=auto,fit=scale-down,q=85,metadata=none,w=600,h=600/app/images/products/sliding_image/457858d.jpg | https://cdn.grofers.com/cdn-cgi/image/f=auto,fit=scale-down,q=85,metadata=none,w=600,h=600/app/images/products/sliding_image/457858e.jpg | https://cdn.grofers.com/cdn-cgi/image/f=auto,fit=scale-down,q=85,metadata=none,w=600,h=600/app/images/products/sliding_image/457858f.jpg | https://cdn.grofers.com/cdn-cgi/image/f=auto,fit=scale-down,q=85,metadata=none,w=600,h=600/app/images/products/sliding_image/457858g.jpg | https://cdn.grofers.com/cdn-cgi/image/f=auto,fit=scale-down,q=85,metadata=none,w=600,h=600/app/images/products/sliding_image/457858h.jpg | https://cdn.grofers.com/cdn-cgi/image/f=auto,fit=scale-down,q=85,metadata=none,w=600,h=600/app/images/products/sliding_image/457858i.jpg | https://cdn.grofers.com/cdn-cgi/image/f=auto,fit=scale-down,q=85,metadata=none,w=600,h=600/app/images/products/sliding_image/457858j.jpg | https://cdn.grofers.com/cdn-cgi/image/f=auto,fit=scale-down,q=85,metadata=none,w=600,h=600/app/images/products/sliding_image/457858k.jpg | https://cdn.grofers.com/cdn-cgi/image/f=auto,fit=scale-down,q=85,metadata=none,w=600,h=600/app/images/products/sliding_image/457858l.jpg | https://cdn.grofers.com/cdn-cgi/image/f=auto,fit=scale-down,q=85,metadata=none,w=600,h=600/app/images/products/sliding_image/457858m.jpg | https://cdn.grofers.com/cdn-cgi/image/f=auto,fit=scale-down,q=85,metadata=none,w=600,h=600/app/images/products/common/customer_care.jpg","[{'Key Features': 'Nuts and seeds mix is a sumptuous combination of 6 nuts and seeds . A handful of these every morning is just what you need to start your day right. Enjoy this mix as topping on your favourite dessert or better, keep this as  a munchie for all your get - togethers .Export size, Finest qualityPremium Dry Fruits'}, {'Shelf Life': '6 months'}, {'Unit': '200 g'}, {'Packaging Type': 'Carton'}, {'Manufacturer Details': 'Udit Fresh Foods Pvt. Ltd. C-344, DSIDC Industrial Area, Narela, New Delhi- 110040'}, {'Marketed By': 'Hands on Trades Pvt. Ltd. 301-B, Hemkunt Chambers 89, Nehru Place, New Delhi-110019'}, {'FSSAI License': '10017011003999'}, {'Country of Origin': 'India'}, {'Customer Care Details': 'Email: info@blinkit.com'}, {'Expiry Date': 'Please refer to the packaging of the product for expiry date.'}, {'Description': 'Nutologyst brings you the finest quality of jumbo dry fruits & trail mixes. These premium snacks are a tastier way to maintain a healthy lifestyle.Relish the goodness of 100% natural ingredients with Nutologyst, your DRY FRUIT EXPERT.'}, {'Disclaimer': 'Every effort is made to maintain accuracy of all information. However, actual product packaging and materials may contain more and/or different information. It is recommended not to solely rely on the information presented.'}]",,db2fb58a-b61c-5e77-9da7-5722e9b24458,19/11/2023 18:07:06
https://blinkit.com/prn/reeses-peanut-butter-chocolate-cups-pack-of-2/prid/492024,Reese's Peanut Butter Chocolate Cups - Pack of 2,Reese's,492024,"Chocolate is especially rich in flavanols like epicatechin and catechin, as well as anthocyanins and phenolic acids. All of these compounds help protect your cells from inflammation, improve your brain function, and boost your immune and cardiovascular health.",120,INR,OutOfStock,blinkit.com,492024,"https://cdn.grofers.com/cdn-cgi/image/f=auto,fit=scale-down,q=85,metadata=none,w=600,h=600/app/images/products/full_screen/pro_492024.jpg?ts=1684834053 | https://cdn.grofers.com/cdn-cgi/image/f=auto,fit=scale-down,q=85,metadata=none,w=600,h=600/app/images/products/sliding_image/492024a.jpg?ts=1690814760 | https://cdn.grofers.com/cdn-cgi/image/f=auto,fit=scale-down,q=85,metadata=none,w=600,h=600/app/images/products/sliding_image/492024b.jpg?ts=1690814760 | https://cdn.grofers.com/cdn-cgi/image/f=auto,fit=scale-down,q=85,metadata=none,w=600,h=600/app/images/products/sliding_image/492024c.jpg?ts=1690814760 | https://cdn.grofers.com/cdn-cgi/image/f=auto,fit=scale-down,q=85,metadata=none,w=600,h=600/app/images/products/sliding_image/492024d.jpg?ts=1690814760 | https://cdn.grofers.com/cdn-cgi/image/f=auto,fit=scale-down,q=85,metadata=none,w=600,h=600/app/images/products/common/customer_care.jpg","[{'Offer': 'Pack of 2'}, {'Unit': '2 x 42 g'}, {'Packaging Type': 'Packet'}, {'Shelf Life': '12 months'}, {'Manufacturer Details': 'COCOCART VENTURES PVT LTD. D-72/1, 2nd Floor, TTC Industrial Area, MIDC Main Road, Turbhe, Navi Mumbai, Mumbai Suburban, Maharashtra 400705'}, {'Marketed By': 'COCOCART VENTURES PVT LTD. D-72/1, 2nd Floor, TTC Industrial Area, MIDC Main Road, Turbhe, Navi Mumbai, Mumbai Suburban, Maharashtra 400705'}, {'FSSAI License': '10021022000090'}, {'Country of Origin': 'USA'}, {'Customer Care Details': 'Email: info@blinkit.com'}, {'Return Policy': 'This Item is non-returnable. For a damaged, defective, incorrect or expired item, you can request a replacement within 72 hours of delivery. In case of an incorrect item, you may raise a replacement or return request only if the item is sealed/ unopened/ unused and in original condition.'}, {'Expiry Date': 'Please refer to the packaging of the product for expiry date.'}, {'Description': 'Chocolate is especially rich in flavanols like epicatechin and catechin, as well as anthocyanins and phenolic acids. All of these compounds help protect your cells from inflammation, improve your brain function, and boost your immune and cardiovascular health.'}, {'Disclaimer': 'Every effort is made to maintain the accuracy of all information. However, actual product packaging and materials may contain more and/or different information. It is recommended not to solely rely on the information presented.'}]",,c5cd1783-0c7d-5d27-93eb-de0c2a08df7b,19/11/2023 18:07:09
https://blinkit.com/prn/bath-body-works-dark-kiss-fragrance-mist/prid/492100,Bath & Body Works Dark Kiss Fragrance Mist,Bath & Body Works,492100,Buy Bath & Body Works Dark Kiss Fragrance Mist online in India at lowest price and get super fast home delivery with easy returns. Available in  236 ml,1699,INR,OutOfStock,blinkit.com,492100,"https://cdn.grofers.com/cdn-cgi/image/f=auto,fit=scale-down,q=85,metadata=none,w=600,h=600/app/images/products/full_screen/pro_492100.jpg?ts=1685984379 | https://cdn.grofers.com/cdn-cgi/image/f=auto,fit=scale-down,q=85,metadata=none,w=600,h=600/app/images/products/sliding_image/492100a.jpg?ts=1672822307 | https://cdn.grofers.com/cdn-cgi/image/f=auto,fit=scale-down,q=85,metadata=none,w=600,h=600/app/images/products/sliding_image/492100b.jpg?ts=1672822307 | https://cdn.grofers.com/cdn-cgi/image/f=auto,fit=scale-down,q=85,metadata=none,w=600,h=600/app/images/products/sliding_image/492100c.jpg?ts=1672822307 | https://cdn.grofers.com/cdn-cgi/image/f=auto,fit=scale-down,q=85,metadata=none,w=600,h=600/app/images/products/sliding_image/492100d.jpg?ts=1672822307 | https://cdn.grofers.com/cdn-cgi/image/f=auto,fit=scale-down,q=85,metadata=none,w=600,h=600/app/images/products/common/customer_care.jpg","[{'Oriental Floral': 'Fragrance Family'}, {'Mild': 'Strength'}, {'Women': 'Gender'}, {'Mist': 'Formulation'}, {'Preferences': 'Cruelty-Free, Silicone-Free'}, {'Shelf Life': '36 months'}, {'Packaging Type': 'Spray Bottle'}, {'Unit': '236 ml'}, {'Country of Origin': 'US'}, {'Customer Care Details': 'Email: info@blinkit.com'}, {'Return Policy': 'You may replace this item within 72 hours of buying if in case it is found faulty, damaged or incorrect. After 72 hours, kindly contact the brand service centre. In case of an incorrect item, you may raise a replacement request only if the item is sealed/ unopened/ unused and in original condition.'}, {'Expiry Date': 'Please refer to the packaging of the product for expiry date.'}, {'Disclaimer': 'Every effort is made to maintain accuracy of all information. However, actual product packaging and materials may contain more and/or different information. The color of the product displayed in the image may differ from that received in the order. It is recommended not to solely rely on the details presented.'}]",,7542bb22-ed75-5e56-b92a-ec613bbf3d53,19/11/2023 18:07:09
https://blinkit.com/prn/faces-canada-all-day-hydra-matte-foundation-golden-beige-032/prid/504278,Faces Canada All Day Hydra Matte Foundation (Golden Beige 032),Faces Canada,504278,Buy Faces Canada All Day Hydra Matte Foundation (Golden Beige 032) online in India at lowest price and get super fast home delivery with easy returns. Available in  25 ml,412,INR,InStock,blinkit.com,504278,"https://cdn.grofers.com/cdn-cgi/image/f=auto,fit=scale-down,q=85,metadata=none,w=600,h=600/app/images/products/full_screen/pro_504278.jpg?ts=1685980010 | https://cdn.grofers.com/cdn-cgi/image/f=auto,fit=scale-down,q=85,metadata=none,w=600,h=600/app/images/products/sliding_image/504278a.jpg?ts=1690829799 | https://cdn.grofers.com/cdn-cgi/image/f=auto,fit=scale-down,q=85,metadata=none,w=600,h=600/app/images/products/sliding_image/504278b.jpg?ts=1690829799 | https://cdn.grofers.com/cdn-cgi/image/f=auto,fit=scale-down,q=85,metadata=none,w=600,h=600/app/images/products/sliding_image/504278c.jpg?ts=1690829799 | https://cdn.grofers.com/cdn-cgi/image/f=auto,fit=scale-down,q=85,metadata=none,w=600,h=600/app/images/products/sliding_image/504278d.jpg?ts=1690829799 | https://cdn.grofers.com/cdn-cgi/image/f=auto,fit=scale-down,q=85,metadata=none,w=600,h=600/app/images/products/sliding_image/504278e.jpg?ts=1690829799 | https://cdn.grofers.com/cdn-cgi/image/f=auto,fit=scale-down,q=85,metadata=none,w=600,h=600/app/images/products/sliding_image/504278f.jpg?ts=1690829799 | https://cdn.grofers.com/cdn-cgi/image/f=auto,fit=scale-down,q=85,metadata=none,w=600,h=600/app/images/products/sliding_image/504278g.jpg?ts=1690829799 | https://cdn.grofers.com/cdn-cgi/image/f=auto,fit=scale-down,q=85,metadata=none,w=600,h=600/app/images/products/sliding_image/504278h.jpg?ts=1690829799 | https://cdn.grofers.com/cdn-cgi/image/f=auto,fit=scale-down,q=85,metadata=none,w=600,h=600/app/images/products/common/customer_care.jpg","[{'Fair/Light': 'Skin Tone'}, {'Liquid': 'Formulation'}, {'Matte': 'Finish'}, {'30': 'SPF'}, {'Ingredients': 'Aqua, Is, Isododecane, Cyclopentasiloxane, Ethylhexyl Methoxycinnamate, Propylene Glycol, Ethylhexyl Salicylate, Cyclohexasiloxane, Talc, Cetyl Peg/Ppg-10/1 Dimethicone, Sodium Chloride, Peg-10 Dimethicone, Sodium Gluconate, Sodium Lactate, Phenoxyethanol, Aluminum Hydroxide, Xanthan Gum, Methicone, Triethoxycaprylylsilane, Tetrasodium Edta, Disteardimonium Hectorite, Aluminum Hydroxide, Xanthan Gum, Methicone, Triethoxycaprylylsilane, Tetrasodium Edta, Disteardimonium Hectorite, Peg-10, Propylene Carbonate, Butyl Methoxydibenzoylmethane, Tocopherol, May Contain, Intercosmetic Asia Pacific Sdn Bhd, Titanium Dioxide (Ci 77891), Iron Oxides (Ci 77492, Iron Oxides (Ci 77491), Iron Oxides (Ci 77499).'}, {'Usage': 'Take a few drops of the All Day Hydra Matte Foundation on the Faces Canada Foundation Brush and carefully apply on the face.'}, {'Preferences': 'PETA certified, Paraben-Free, Vegan'}, {'Undertone': 'Warm'}, {'Shelf Life': '36 months'}, {'Coverage': 'Medium'}, {'Concern': 'Brightening, Dryness, Dullness'}, {'Skin Type': 'Normal'}, {'Unit': '25 ml'}, {'Key Features': 'All Day Hydra Matte Foundation is a multi-benefit foundation + moisturizer + sunscreen.It has the benefits of a high-coverage foundation, a broad UV spectrum of SPF 30 and the goodness of a moisturizer.The foundation is unbelievable lightweight making sure that you feel comfortable throughout the day.This oil-free matte foundation has a silky smooth texture that will allow it to blend super easily.'}, {'Manufacturer Details': 'Faces Canada, Faces Cosmetics India Pvt. Ltd. Unit No 910 & 911,9th Floor, Unitech Commercial Tower - II,Greenwood City,Sec-45, Gurugram - 122001'}, {'Marketed By': 'Faces Cosmetics India Pvt. Ltd., Unit No 910 & 911, 9th Floor, Unitech Commercial Tower - II, Greenwood City, Sec-45, Gurugram - 122001'}, {'Country of Origin': 'India'}, {'Customer Care Details': 'Email: info@blinkit.com'}, {'Return Policy': 'You may replace this item within 72 hours of buying if in case it is found faulty, damaged or incorrect. After 72 hours, kindly contact the brand service centre. In case of an incorrect item, you may raise a replacement request only if the item is sealed/ unopened/ unused and in original condition.'}, {'Seller': 'SUPERWELL COMTRADE PRIVATE LIMITED'}, {'Disclaimer': 'Every effort is made to maintain accuracy of all information. However, actual product packaging and materials may contain more and/or different information. It is recommended not to solely rely on the information presented.'}]",Face Makeup,e42366aa-fb59-5672-9896-05cb2681705c,19/11/2023 18:07:53
https://blinkit.com/prn/sheba-rich-fish-with-sasami-wet-cat-food/prid/474921,Sheba Rich - Fish with Sasami Wet Cat Food,Sheba,474921,Sheba Pouch Fish With Sasami - Pack of 12,540,INR,InStock,blinkit.com,474921,"https://cdn.grofers.com/cdn-cgi/image/f=auto,fit=scale-down,q=85,metadata=none,w=600,h=600/app/images/products/full_screen/pro_474921.jpg?ts=1685980441 | https://cdn.grofers.com/cdn-cgi/image/f=auto,fit=scale-down,q=85,metadata=none,w=600,h=600/app/images/products/sliding_image/474921a.jpg?ts=1690814428 | https://cdn.grofers.com/cdn-cgi/image/f=auto,fit=scale-down,q=85,metadata=none,w=600,h=600/app/images/products/sliding_image/474921b.jpg?ts=1690814428 | https://cdn.grofers.com/cdn-cgi/image/f=auto,fit=scale-down,q=85,metadata=none,w=600,h=600/app/images/products/sliding_image/474921c.jpg?ts=1690814428 | https://cdn.grofers.com/cdn-cgi/image/f=auto,fit=scale-down,q=85,metadata=none,w=600,h=600/app/images/products/sliding_image/474921d.jpg?ts=1690814428 | https://cdn.grofers.com/cdn-cgi/image/f=auto,fit=scale-down,q=85,metadata=none,w=600,h=600/app/images/products/sliding_image/474921e.jpg?ts=1690814428 | https://cdn.grofers.com/cdn-cgi/image/f=auto,fit=scale-down,q=85,metadata=none,w=600,h=600/app/images/products/sliding_image/474921f.jpg?ts=1690814428 | https://cdn.grofers.com/cdn-cgi/image/f=auto,fit=scale-down,q=85,metadata=none,w=600,h=600/app/images/products/sliding_image/474921g.jpg?ts=1690814428 | https://cdn.grofers.com/cdn-cgi/image/f=auto,fit=scale-down,q=85,metadata=none,w=600,h=600/app/images/products/sliding_image/474921h.jpg?ts=1690814428 | https://cdn.grofers.com/cdn-cgi/image/f=auto,fit=scale-down,q=85,metadata=none,w=600,h=600/app/images/products/common/customer_care.jpg","[{'Key Features': 'Premium cat food for your special furry friendRich fish mix with Sasami in Gravy, an idealMin. 10% Protein in each pouch for cat’s complete nutritionThe high-quality meal offers a tantalizing texturefor cat with a pleasing consistency, ideal for adult catsGreat calorific value in a small serving size - 20Kcal/1packSuited for Persian Cat, British Shorthair to Siamese Cat'}, {'Ingredients': 'Fish (Bonito), Sasami, Dried Bonito Flakes, Polysaccharide thickener, Seasoning (Amino Acids)'}, {'Unit': '12 x 35 g'}, {'Packaging Type': 'Bag'}, {'Shelf Life': '24 months'}, {'Manufacturer Details': 'Mars Petcare (Thailand) Co Ltd, 799 MOO 4, Chantuk, Pakchong, Nakorn Ratchasima 30130, Thailand , +66 44- 310500'}, {'Marketed By': 'Mars International India Pvt ltd. 4658.A.No 21, Ansari Road , Darya Ganj, New Delhi 110002'}, {'Country of Origin': 'Thailand'}, {'Customer Care Details': 'Email: info@blinkit.com'}, {'Expiry Date': 'Please refer to the packaging of the product for expiry date.'}, {'Seller': 'TAMS GLOBAL PRIVATE LIMITED'}, {'Seller FSSAI': '13323999000106'}, {'Description': 'Sheba Pouch Fish With Sasami - Pack of 12'}, {'Disclaimer': 'Every effort is made to maintain accuracy of all information. However, actual product packaging and materials may contain more and/or different information. It is recommended not to solely rely on the information presented.'}]",Cat Food,c64d38b7-f73a-57d5-bc69-033b2f6a44d3,19/11/2023 18:07:53
https://blinkit.com/prn/fevistik-super-glue-stick-white/prid/155908,Fevistik Super Glue Stick (White),Fevistik,155908,Buy Fevistik Super Glue Stick (White) online in India at lowest price and get super fast home delivery with easy returns. Available in  8 g,25,INR,OutOfStock,blinkit.com,155908,"https://cdn.grofers.com/cdn-cgi/image/f=auto,fit=scale-down,q=85,metadata=none,w=600,h=600/app/images/products/full_screen/pro_155908.jpg?ts=1685979939 | https://cdn.grofers.com/cdn-cgi/image/f=auto,fit=scale-down,q=85,metadata=none,w=600,h=600/app/images/products/sliding_image/155908a.jpg?ts=1687437710 | https://cdn.grofers.com/cdn-cgi/image/f=auto,fit=scale-down,q=85,metadata=none,w=600,h=600/app/images/products/sliding_image/155908b.jpg | https://cdn.grofers.com/cdn-cgi/image/f=auto,fit=scale-down,q=85,metadata=none,w=600,h=600/app/images/products/common/customer_care.jpg","[{'Key Features': 'Experience clean and convenient sticking through this innovative rotary gluestick. Rotate bottom clockwise if needed more it comes smooth and even.Ideal for paper to paper bonding. Extra strong adhesive ideal for sticking paper.Ready to use fast drying & smooth application.Fevistik glue is a transparent adhesive great for office school and arts and crafts & student projects requirement.'}, {'Colour': 'White'}, {'Unit': '8 g'}, {'Weight': '8 g'}, {'Dimensions (cm)': '38x28x12'}, {'Manufacturer Details': 'Pidilite Industries Ltd. Regent Chambers, Nariman Point, Mumbai 400021'}, {'Marketed By': 'Pidilite Ind. Ltd. Ramkrishna Mandir Road Kondivit And. East Mumbai 400059.'}, {'Country of Origin': 'India'}, {'Customer Care Details': 'Email: info@blinkit.com'}, {'Return Policy': 'This Item is non-returnable. For a damaged, defective, incorrect or expired item, you can request a replacement within 72 hours of delivery. In case of an incorrect item, you may raise a replacement or return request only if the item is sealed/ unopened/ unused and in original condition.'}, {'Expiry Date': 'Please refer to the packaging of the product for expiry date.'}, {'Disclaimer': 'Every effort is made to maintain the accuracy of all information. However, actual product packaging and materials may contain more and/or different information. The color of the product displayed in the image may differ from that received in the order. It is recommended not to solely rely on the details presented.'}]",,9c5dd83f-2c54-5b5e-a245-b277d5a3878c,19/11/2023 18:07:56
