url,name,brand,sku,description,price,currency,availability,source,pid,images,product_details,breads,uniq_id,scraped_at
https://blinkit.com/prn/mtr-upma-breakfast-mix-pack-of-2/prid/484435,MTR Upma Breakfast Mix - Pack of 2,MTR,484435,"MTR Upma Instant Mix offers a healthy combination of suji and seasoning. With a pinch of green chilli, ginger, curry leaves and mustard seeds, this mix has a truly traditional taste, which offers a relishing experience. Bring home the confidence of great tasty food, with this authentic offering from the house of MTR.",109,INR,InStock,blinkit.com,484435,"https://cdn.grofers.com/cdn-cgi/image/f=auto,fit=scale-down,q=85,metadata=none,w=600,h=600/app/images/products/full_screen/pro_484435.jpg?ts=1684832561 | https://cdn.grofers.com/cdn-cgi/image/f=auto,fit=scale-down,q=85,metadata=none,w=600,h=600/app/images/products/sliding_image/484435a.jpg?ts=1677230383 | https://cdn.grofers.com/cdn-cgi/image/f=auto,fit=scale-down,q=85,metadata=none,w=600,h=600/app/images/products/sliding_image/484435b.jpg?ts=1677230383 | https://cdn.grofers.com/cdn-cgi/image/f=auto,fit=scale-down,q=85,metadata=none,w=600,h=600/app/images/products/sliding_image/484435c.jpg?ts=1677230383 | https://cdn.grofers.com/cdn-cgi/image/f=auto,fit=scale-down,q=85,metadata=none,w=600,h=600/app/images/products/sliding_image/484435d.jpg?ts=1677230383 | https://cdn.grofers.com/cdn-cgi/image/f=auto,fit=scale-down,q=85,metadata=none,w=600,h=600/app/images/products/sliding_image/484435e.jpg?ts=1677230383 | https://cdn.grofers.com/cdn-cgi/image/f=auto,fit=scale-down,q=85,metadata=none,w=600,h=600/app/images/products/sliding_image/484435f.jpg?ts=1677230383 | https://cdn.grofers.com/cdn-cgi/image/f=auto,fit=scale-down,q=85,metadata=none,w=600,h=600/app/images/products/sliding_image/484435g.jpg?ts=1677230383 | https://cdn.grofers.com/cdn-cgi/image/f=auto,fit=scale-down,q=85,metadata=none,w=600,h=600/app/images/products/sliding_image/484435h.jpg?ts=1677230383 | https://cdn.grofers.com/cdn-cgi/image/f=auto,fit=scale-down,q=85,metadata=none,w=600,h=600/app/images/products/common/customer_care.jpg","[{'Key Features': 'Instant breakfast mixWith homemade authentic flavour, taste and aroma'}, {'Offer': 'Pack of 2'}, {'Ingredients': 'Semolina(75%), Edible Vegetable Fat, Salt, Bengal Gram Dal, Lemon Powder, Green Chilli, Ginger, Sugar, Curry Leaves, Mustard, Anti Caking Agent (Ins 551)'}, {'Contents': 'MTR Upma Breakfast Mix - 170 g'}, {'Unit': '2 x 160 g'}, {'Shelf Life': '9 months'}, {'Country of Origin': 'India'}, {'Customer Care Details': 'Email: info@blinkit.com'}, {'Expiry Date': 'Please refer to the packaging of the product for expiry date.'}, {'Seller': '90MINUTES RETAIL PRIVATE LIMITED'}, {'Seller FSSAI': '10019064001734'}, {'Description': 'MTR Upma Instant Mix offers a healthy combination of suji and seasoning. With a pinch of green chilli, ginger, curry leaves and mustard seeds, this mix has a truly traditional taste, which offers a relishing experience. Bring home the confidence of great tasty food, with this authentic offering from the house of MTR.'}, {'Disclaimer': 'Every effort is made to maintain accuracy of all information. However, actual product packaging and materials may contain more and/or different information. It is recommended not to solely rely on the information presented.'}]",Instant Mixes,86e2a461-a2da-536f-bfd3-b0c39cc95d8c,19/11/2023 18:11:59
https://blinkit.com/prn/catch-raita-masala/prid/21871,Catch Raita Masala,Catch,21871,Catch Raita Masala gives your simple curd and vegetables a delicious savoury touch. All-in-one combination of all the Indian masala used as a condiment. This made with advanced LTG technology which retains the flavour and aroma of spices in their original state.,55,INR,OutOfStock,blinkit.com,21871,"https://cdn.grofers.com/cdn-cgi/image/f=auto,fit=scale-down,q=85,metadata=none,w=600,h=600/app/images/products/full_screen/pro_21871.jpg?ts=1684834759 | https://cdn.grofers.com/cdn-cgi/image/f=auto,fit=scale-down,q=85,metadata=none,w=600,h=600/app/images/products/sliding_image/21871a.jpg?ts=1690817539 | https://cdn.grofers.com/cdn-cgi/image/f=auto,fit=scale-down,q=85,metadata=none,w=600,h=600/app/images/products/sliding_image/21871b.jpg?ts=1690817539 | https://cdn.grofers.com/cdn-cgi/image/f=auto,fit=scale-down,q=85,metadata=none,w=600,h=600/app/images/products/sliding_image/21871c.jpg?ts=1690817539 | https://cdn.grofers.com/cdn-cgi/image/f=auto,fit=scale-down,q=85,metadata=none,w=600,h=600/app/images/products/sliding_image/21871d.jpg?ts=1690817539 | https://cdn.grofers.com/cdn-cgi/image/f=auto,fit=scale-down,q=85,metadata=none,w=600,h=600/app/images/products/sliding_image/21871e.jpg?ts=1690817539 | https://cdn.grofers.com/cdn-cgi/image/f=auto,fit=scale-down,q=85,metadata=none,w=600,h=600/app/images/products/sliding_image/21871f.jpg?ts=1690817539 | https://cdn.grofers.com/cdn-cgi/image/f=auto,fit=scale-down,q=85,metadata=none,w=600,h=600/app/images/products/sliding_image/21871g.jpg?ts=1690817539 | https://cdn.grofers.com/cdn-cgi/image/f=auto,fit=scale-down,q=85,metadata=none,w=600,h=600/app/images/products/sliding_image/21871h.jpg?ts=1690817539 | https://cdn.grofers.com/cdn-cgi/image/f=auto,fit=scale-down,q=85,metadata=none,w=600,h=600/app/images/products/sliding_image/21871i.jpg?ts=1690817539 | https://cdn.grofers.com/cdn-cgi/image/f=auto,fit=scale-down,q=85,metadata=none,w=600,h=600/app/images/products/sliding_image/21871j.jpg?ts=1690817539 | https://cdn.grofers.com/cdn-cgi/image/f=auto,fit=scale-down,q=85,metadata=none,w=600,h=600/app/images/products/common/customer_care.jpg","[{'Key Features': 'Catch Raita Masala adds a salty and tangy taste to simple curd preparations.Raita masala makes your regular curd-preparation a perfect accompaniment for your meals.Appropriate to use with Tomato, Vegetable, Boondi & Onion raitas.Made using Low Temperature Grinding Technology.'}, {'Shelf Life': '12 months'}, {'Unit': '100 g'}, {'Ingredients': 'Cumin Whole, Edible Common Salt (Black Salt), Coriander Whole, Iodized Salt, Pepper Black, Dried Mango Slices, Ginger Whole, Ajowan, Mint, Chillies and Capsicum Whole.'}, {'Usage': 'Sprinkle Catch Raita Masala on Onion, Boondi, Fruit or Cucumber Raita'}, {'Manufacturer Details': 'DS SPICECO PVT LTD, B - 6, 17, 18, 19 SECTOR - 3 NOIDA 201301 UP'}, {'FSSAI License': '10021051000106'}, {'Country of Origin': 'India'}, {'Customer Care Details': 'Email: info@blinkit.com'}, {'Return Policy': 'This Item is non-returnable. For a damaged, defective, incorrect or expired item, you can request a replacement within 72 hours of delivery. In case of an incorrect item, you may raise a replacement or return request only if the item is sealed/ unopened/ unused and in original condition.'}, {'Expiry Date': 'Please refer to the packaging of the product for expiry date.'}, {'Description': 'Catch Raita Masala gives your simple curd and vegetables a delicious savoury touch. All-in-one combination of all the Indian masala used as a condiment. This made with advanced LTG technology which retains the flavour and aroma of spices in their original state.'}, {'Disclaimer': 'Every effort is made to maintain accuracy of all information. However, actual product packaging and materials may contain more and/or different information. It is recommended not to solely rely on the information presented.'}]",,3c424fa0-0a29-5d5e-a189-a6646a9e9410,19/11/2023 18:12:08
https://blinkit.com/prn/remia-light-mayonnaise/prid/476907,Remia Light Mayonnaise,Remia,476907,Buy Remia Light Mayonnaise online in India at lowest price and get super fast home delivery with easy returns. Available in  250 g,230,INR,OutOfStock,blinkit.com,476907,"https://cdn.grofers.com/cdn-cgi/image/f=auto,fit=scale-down,q=85,metadata=none,w=600,h=600/app/images/products/full_screen/pro_476907.jpg?ts=1684832407 | https://cdn.grofers.com/cdn-cgi/image/f=auto,fit=scale-down,q=85,metadata=none,w=600,h=600/app/images/products/sliding_image/476907a.jpg?ts=1690814592 | https://cdn.grofers.com/cdn-cgi/image/f=auto,fit=scale-down,q=85,metadata=none,w=600,h=600/app/images/products/sliding_image/476907b.jpg?ts=1690814592 | https://cdn.grofers.com/cdn-cgi/image/f=auto,fit=scale-down,q=85,metadata=none,w=600,h=600/app/images/products/sliding_image/476907c.jpg?ts=1690814592 | https://cdn.grofers.com/cdn-cgi/image/f=auto,fit=scale-down,q=85,metadata=none,w=600,h=600/app/images/products/sliding_image/476907d.jpg?ts=1690814592 | https://cdn.grofers.com/cdn-cgi/image/f=auto,fit=scale-down,q=85,metadata=none,w=600,h=600/app/images/products/common/customer_care.jpg","[{'Shelf Life': '18 months'}, {'Manufacturer Details': 'Remia C.V. Dolder Seweg 107 3734 Be Den Dolder, The Netherlands'}, {'Marketed By': 'Suresh Kumar & Co. (Impex) Pvt. Ltd. A-17,Mukherjee Nagar,Delhi-110009'}, {'FSSAI License': '10015011002594'}, {'Country of Origin': 'Netherlands'}, {'Customer Care Details': 'Email: info@blinkit.com'}, {'Return Policy': 'This Item is non-returnable. For a damaged, defective, incorrect or expired item, you can request a replacement within 72 hours of delivery. In case of an incorrect item, you may raise a replacement or return request only if the item is sealed/ unopened/ unused and in original condition.'}, {'Expiry Date': 'Please refer to the packaging of the product for expiry date.'}, {'Ingredients': 'water, rapseed oil 25%, wheat starch, glucose, fructose, egg, egg yolk, maize starch, salt, sugar, modified starch, acids, mustard floor, guar gum, preservative potassium.'}, {'Unit': '250 g'}, {'Packaging Type': 'Glass Bottle'}, {'Disclaimer': 'Every effort is made to maintain accuracy of all information. However, actual product packaging and materials may contain more and/or different information. It is recommended not to solely rely on the information presented.'}, {'Description': 'Remia Mayolite is less Fat Mayonnaise & high qualities Ingredients'}]",,bcd2d7c0-b09c-5cc2-ac68-40a1706f678e,19/11/2023 18:12:09
https://blinkit.com/prn/town-grocer-salted-pistachios-pack-of-2/prid/493882,Town Grocer Salted Pistachios - Pack of 2,Town Grocer,493882,Buy Town Grocer Salted Pistachios - Pack of 2 online in India at lowest price and get super fast home delivery with easy returns. Available in  2 x 100 g,1,INR,OutOfStock,blinkit.com,493882,"https://cdn.grofers.com/cdn-cgi/image/f=auto,fit=scale-down,q=85,metadata=none,w=600,h=600/app/images/products/full_screen/pro_493882.jpg?ts=1685974006 | https://cdn.grofers.com/cdn-cgi/image/f=auto,fit=scale-down,q=85,metadata=none,w=600,h=600/app/images/products/sliding_image/493882a.jpg | https://cdn.grofers.com/cdn-cgi/image/f=auto,fit=scale-down,q=85,metadata=none,w=600,h=600/app/images/products/sliding_image/493882b.jpg | https://cdn.grofers.com/cdn-cgi/image/f=auto,fit=scale-down,q=85,metadata=none,w=600,h=600/app/images/products/sliding_image/493882c.jpg | https://cdn.grofers.com/cdn-cgi/image/f=auto,fit=scale-down,q=85,metadata=none,w=600,h=600/app/images/products/sliding_image/493882d.jpg | https://cdn.grofers.com/cdn-cgi/image/f=auto,fit=scale-down,q=85,metadata=none,w=600,h=600/app/images/products/sliding_image/493882e.jpg | https://cdn.grofers.com/cdn-cgi/image/f=auto,fit=scale-down,q=85,metadata=none,w=600,h=600/app/images/products/sliding_image/493882f.jpg | https://cdn.grofers.com/cdn-cgi/image/f=auto,fit=scale-down,q=85,metadata=none,w=600,h=600/app/images/products/sliding_image/493882g.jpg | https://cdn.grofers.com/cdn-cgi/image/f=auto,fit=scale-down,q=85,metadata=none,w=600,h=600/app/images/products/sliding_image/493882h.jpg | https://cdn.grofers.com/cdn-cgi/image/f=auto,fit=scale-down,q=85,metadata=none,w=600,h=600/app/images/products/common/customer_care.jpg","[{'Key Features': 'Perfect to relish as a part of a healthy diet. Seasoned with a dab of salt. Healthy and Nutritious nut. Flavourful addition to salads, appetizers, desserts etc.'}, {'Shelf Life': '4 months'}, {'Unit': '2 x 100 g'}, {'Offer': 'Pack of 2'}, {'Packaging Type': 'Pouch'}, {'Manufacturer Details': 'Congruence Trade And Services Pvt. Ltd., Plot No. 14, Attibele Industrial Area, Anekal Taluk, Bangalore-562107'}, {'Marketed By': 'Congruence Trade And Services Pvt. Ltd., Plot No. 14, Attibele Industrial Area, Anekal Taluk, Bangalore-562107'}, {'FSSAI License': '11220302000664'}, {'Country of Origin': 'India'}, {'Customer Care Details': 'Email: info@blinkit.com'}, {'Return Policy': 'This Item is non-returnable. For a damaged, defective, incorrect or expired item, you can request a replacement within 72 hours of delivery. In case of an incorrect item, you may raise a replacement or return request only if the item is sealed/ unopened/ unused and in original condition.'}, {'Expiry Date': 'Please refer to the packaging of the product for expiry date.'}, {'Disclaimer': 'Every effort is made to maintain the accuracy of all information. However, actual product packaging and materials may contain more and/or different information. It is recommended not to solely rely on the information presented.'}]",,d8dc4d62-80a4-5a68-9554-a1faa7d07bde,19/11/2023 18:12:10
https://blinkit.com/prn/sugar-free-green-sweetener/prid/386253,Sugar Free Green Stevia Sweetener,Sugar Free Green,386253,"Made from 100% Natural source of Stevia plant whose leaves are naturally sweet, stevia leaves are also known as Meethi Tulsi in India, sweet just like Sugar, and helps save approximately 20 calories for every 5g of Sugar replaced with 1 Pellet of Sugar Free Green, you can stop worrying about any extra Sugar-calories while you indulge in your daily cup of sweet tea, sugarFree Green can be used for a wide variety of hot & cold beverages.",245,INR,OutOfStock,blinkit.com,386253,"https://cdn.grofers.com/cdn-cgi/image/f=auto,fit=scale-down,q=85,metadata=none,w=600,h=600/app/images/products/full_screen/pro_386253.jpg?ts=1696940007 | https://cdn.grofers.com/cdn-cgi/image/f=auto,fit=scale-down,q=85,metadata=none,w=600,h=600/app/images/products/sliding_image/386253a.jpg?ts=1696940007 | https://cdn.grofers.com/cdn-cgi/image/f=auto,fit=scale-down,q=85,metadata=none,w=600,h=600/app/images/products/sliding_image/386253b.jpg?ts=1696940007 | https://cdn.grofers.com/cdn-cgi/image/f=auto,fit=scale-down,q=85,metadata=none,w=600,h=600/app/images/products/sliding_image/386253c.jpg?ts=1696940007 | https://cdn.grofers.com/cdn-cgi/image/f=auto,fit=scale-down,q=85,metadata=none,w=600,h=600/app/images/products/sliding_image/386253d.jpg?ts=1696940007 | https://cdn.grofers.com/cdn-cgi/image/f=auto,fit=scale-down,q=85,metadata=none,w=600,h=600/app/images/products/sliding_image/386253e.jpg?ts=1696940007 | https://cdn.grofers.com/cdn-cgi/image/f=auto,fit=scale-down,q=85,metadata=none,w=600,h=600/app/images/products/sliding_image/386253f.jpg?ts=1696940007 | https://cdn.grofers.com/cdn-cgi/image/f=auto,fit=scale-down,q=85,metadata=none,w=600,h=600/app/images/products/sliding_image/386253g.jpg?ts=1696940007 | https://cdn.grofers.com/cdn-cgi/image/f=auto,fit=scale-down,q=85,metadata=none,w=600,h=600/app/images/products/sliding_image/386253h.jpg | https://cdn.grofers.com/cdn-cgi/image/f=auto,fit=scale-down,q=85,metadata=none,w=600,h=600/app/images/products/common/customer_care.jpg","[{'Key Features': 'Sweetener made from 100% Natural Stevia leavesSweet, just like Sugar, but with no calories from SugarIt can be used for a variety of hot & cold beverages, as well as for cooking & bakingSafe for the entire family to consume, including kids1 pellet equals 1 tsp Sugar in SweetnessCan be used for a wide variety of preparations such as hot & cold beverages, sweets, desserts, cakes etc.You can binge guilt-free on your favourite sweet treats, without having to worry about any extra Sugar-calories.'}, {'Shelf Life': '24 months'}, {'Unit': '300 tablets'}, {'Packaging Type': 'Box'}, {'FSSAI License': '10012035000021'}, {'Country of Origin': 'India'}, {'Customer Care Details': 'Email: info@blinkit.com'}, {'Return Policy': 'This Item is non-returnable. For a damaged, defective, incorrect or expired item, you can request a replacement within 72 hours of delivery. In case of an incorrect item, you may raise a replacement or return request only if the item is sealed/ unopened/ unused and in original condition.'}, {'Expiry Date': 'Please refer to the packaging of the product for expiry date.'}, {'Description': 'Made from 100% Natural source of Stevia plant whose leaves are naturally sweet, stevia leaves are also known as Meethi Tulsi in India, sweet just like Sugar, and helps save approximately 20 calories for every 5g of Sugar replaced with 1 Pellet of Sugar Free Green, you can stop worrying about any extra Sugar-calories while you indulge in your daily cup of sweet tea, sugarFree Green can be used for a wide variety of hot & cold beverages.'}, {'Disclaimer': 'Every effort is made to maintain accuracy of all information. However, actual product packaging and materials may contain more and/or different information. It is recommended not to solely rely on the information presented.'}]","Salt, Sugar & Jaggery",5fabe8c4-d6a6-5e33-a1ae-7d38be4e2ef9,19/11/2023 18:12:11
https://blinkit.com/prn/bare-anatomy-anti-frizz-shampoo/prid/489264,Bare Anatomy Anti Frizz Shampoo,Bare Anatomy,489264,Buy Bare Anatomy Anti Frizz Shampoo online in India at lowest price and get super fast home delivery with easy returns. Available in  250 ml,387,INR,InStock,blinkit.com,489264,"https://cdn.grofers.com/cdn-cgi/image/f=auto,fit=scale-down,q=85,metadata=none,w=600,h=600/app/images/products/full_screen/pro_489264.jpg?ts=1684834597 | https://cdn.grofers.com/cdn-cgi/image/f=auto,fit=scale-down,q=85,metadata=none,w=600,h=600/app/images/products/sliding_image/489264a.jpg?ts=1687333813 | https://cdn.grofers.com/cdn-cgi/image/f=auto,fit=scale-down,q=85,metadata=none,w=600,h=600/app/images/products/sliding_image/489264b.jpg | https://cdn.grofers.com/cdn-cgi/image/f=auto,fit=scale-down,q=85,metadata=none,w=600,h=600/app/images/products/sliding_image/489264c.jpg | https://cdn.grofers.com/cdn-cgi/image/f=auto,fit=scale-down,q=85,metadata=none,w=600,h=600/app/images/products/sliding_image/489264d.jpg | https://cdn.grofers.com/cdn-cgi/image/f=auto,fit=scale-down,q=85,metadata=none,w=600,h=600/app/images/products/sliding_image/489264e.jpg | https://cdn.grofers.com/cdn-cgi/image/f=auto,fit=scale-down,q=85,metadata=none,w=600,h=600/app/images/products/sliding_image/489264f.jpg | https://cdn.grofers.com/cdn-cgi/image/f=auto,fit=scale-down,q=85,metadata=none,w=600,h=600/app/images/products/sliding_image/489264g.jpg | https://cdn.grofers.com/cdn-cgi/image/f=auto,fit=scale-down,q=85,metadata=none,w=600,h=600/app/images/products/sliding_image/489264h.jpg?ts=1680884878 | https://cdn.grofers.com/cdn-cgi/image/f=auto,fit=scale-down,q=85,metadata=none,w=600,h=600/app/images/products/sliding_image/489264i.jpg | https://cdn.grofers.com/cdn-cgi/image/f=auto,fit=scale-down,q=85,metadata=none,w=600,h=600/app/images/products/common/customer_care.jpg","[{'Shelf Life': '18 months'}, {'Manufacturer Details': 'Onesto Labs Pvt. Ltd., 592, Plot No. 592, First & Second Floor, Udyog Vihar Phase V, Gurgaon, Haryana - 122016'}, {'Marketed By': 'Onesto Labs Pvt. Ltd., 592, Plot No. 592, First & Second Floor, Udyog Vihar Phase V, Gurgaon, Haryana - 122016'}, {'Country of Origin': 'India'}, {'Customer Care Details': 'Email: info@blinkit.com'}, {'Return Policy': 'You may replace this item within 72 hours of buying if in case it is found faulty, damaged or incorrect. After 72 hours, kindly contact the brand service centre. In case of an incorrect item, you may raise a replacement request only if the item is sealed/ unopened/ unused and in original condition.'}, {'Expiry Date': 'Please refer to the packaging of the product for expiry date.'}, {'Seller': 'SUPERWELL COMTRADE PRIVATE LIMITED'}, {'Disclaimer': 'Every effort is made to maintain accuracy of all information. However, actual product packaging and materials may contain more and/or different information. The color of the product displayed in the image may differ from that received in the order. It is recommended not to solely rely on the details presented.'}]",Hair Care & Styling,18f4999c-79ed-5c4d-a81a-078106bdea11,19/11/2023 18:12:43
https://blinkit.com/prn/mother-dairy-sweet-lassi-pack-of-2/prid/483845,Mother Dairy Sweet Lassi - Pack of 2,Mother Dairy,483845,"Mother Dairy Sweet Lassi (Bottle) is a delicious, cool refreshing drink. Sweet and healthy, it rejuvenates the body and teams well with the mid-day meals.",39,INR,InStock,blinkit.com,483845,"https://cdn.grofers.com/cdn-cgi/image/f=auto,fit=scale-down,q=85,metadata=none,w=600,h=600/app/images/products/full_screen/pro_483845.jpg?ts=1696595584 | https://cdn.grofers.com/cdn-cgi/image/f=auto,fit=scale-down,q=85,metadata=none,w=600,h=600/app/images/products/sliding_image/483845a.jpg?ts=1690817387 | https://cdn.grofers.com/cdn-cgi/image/f=auto,fit=scale-down,q=85,metadata=none,w=600,h=600/app/images/products/sliding_image/483845b.jpg?ts=1690817387 | https://cdn.grofers.com/cdn-cgi/image/f=auto,fit=scale-down,q=85,metadata=none,w=600,h=600/app/images/products/sliding_image/483845c.jpg?ts=1690817387 | https://cdn.grofers.com/cdn-cgi/image/f=auto,fit=scale-down,q=85,metadata=none,w=600,h=600/app/images/products/common/customer_care.jpg","[{'Key Features': 'Rejuvenates the body Refreshing drink'}, {'Offer': 'Pack of 2'}, {'Unit': '2 x 180 ml'}, {'Packaging Type': 'Bottle'}, {'Shelf Life': '15 days'}, {'FSSAI License': '10014011001895'}, {'Country of Origin': 'India'}, {'Customer Care Details': 'Email: info@blinkit.com'}, {'Return Policy': 'This Item is non-returnable. For a damaged, defective, incorrect or expired item, you can request a replacement within 72 hours of delivery. In case of an incorrect item, you may raise a replacement or return request only if the item is sealed/ unopened/ unused and in original condition.'}, {'Expiry Date': 'Please refer to the packaging of the product for expiry date.'}, {'Seller': '90MINUTES RETAIL PRIVATE LIMITED'}, {'Seller FSSAI': '10019064001734'}, {'Description': 'Mother Dairy Sweet Lassi (Bottle) is a delicious, cool refreshing drink. Sweet and healthy, it rejuvenates the body and teams well with the mid-day meals.'}, {'Disclaimer': 'Every effort is made to maintain accuracy of all information. However, actual product packaging and materials may contain more and/or different information. It is recommended not to solely rely on the information presented.'}]",Milk Drinks,73652b12-b16b-592c-bf1f-903beda832fa,19/11/2023 18:12:54
