url,name,brand,sku,description,price,currency,availability,source,pid,images,product_details,breads,uniq_id,scraped_at
https://blinkit.com/prn/unibic-qubz-belgium-chocolate-wafer-cube/prid/501384,Unibic Qubz Belgium Chocolate Wafer Cube,Unibic,501384,"Buy Unibic Qubz Belgium Chocolate Wafer Cube online in India at lowest price and get super fast home delivery with easy returns. Available in  2 x 150 g, 150 g",80,INR,InStock,blinkit.com,501384,"https://cdn.grofers.com/cdn-cgi/image/f=auto,fit=scale-down,q=85,metadata=none,w=600,h=600/app/images/products/full_screen/pro_501384.jpg?ts=1685975666 | https://cdn.grofers.com/cdn-cgi/image/f=auto,fit=scale-down,q=85,metadata=none,w=600,h=600/app/images/products/sliding_image/501384a.jpg | https://cdn.grofers.com/cdn-cgi/image/f=auto,fit=scale-down,q=85,metadata=none,w=600,h=600/app/images/products/sliding_image/501384b.jpg | https://cdn.grofers.com/cdn-cgi/image/f=auto,fit=scale-down,q=85,metadata=none,w=600,h=600/app/images/products/sliding_image/501384c.jpg | https://cdn.grofers.com/cdn-cgi/image/f=auto,fit=scale-down,q=85,metadata=none,w=600,h=600/app/images/products/sliding_image/501384d.jpg | https://cdn.grofers.com/cdn-cgi/image/f=auto,fit=scale-down,q=85,metadata=none,w=600,h=600/app/images/products/sliding_image/501384e.jpg | https://cdn.grofers.com/cdn-cgi/image/f=auto,fit=scale-down,q=85,metadata=none,w=600,h=600/app/images/products/sliding_image/501384f.jpg | https://cdn.grofers.com/cdn-cgi/image/f=auto,fit=scale-down,q=85,metadata=none,w=600,h=600/app/images/products/sliding_image/501384g.jpg | https://cdn.grofers.com/cdn-cgi/image/f=auto,fit=scale-down,q=85,metadata=none,w=600,h=600/app/images/products/common/customer_care.jpg","[{'Unit': '150 g'}, {'Packaging Type': 'Pouch'}, {'Shelf Life': '6 months'}, {'Manufacturer Details': 'Unibic Foods India Pvt. Ltd., 51/1A Heggadadevanapura, Bangalore- 562123'}, {'Marketed By': 'Unibic Foods India Pvt. Ltd., 1134, Shreeram Nivas, 2nd Floor, 100 Feet Road, H.A.L. 2nd Stage, Indiranagar, Bangalore- 560038'}, {'FSSAI License': '11222999000012'}, {'Country of Origin': 'India'}, {'Customer Care Details': 'Email: info@blinkit.com'}, {'Return Policy': 'This Item is non-returnable. For a damaged, defective, incorrect or expired item, you can request a replacement within 72 hours of delivery. In case of an incorrect item, you may raise a replacement or return request only if the item is sealed/ unopened/ unused and in original condition.'}, {'Seller': 'Bigway Marketing Private Limited'}, {'Seller FSSAI': '13323999000312'}, {'Disclaimer': 'Every effort is made to maintain accuracy of all information. However, actual product packaging and materials may contain more and/or different information. It is recommended not to solely rely on the information presented.'}]",Rusks & Wafers,778b0b41-3b75-54a5-86b1-67b13ccdddb2,19/11/2023 18:08:49
https://blinkit.com/prn/classmate-unruled-a4-sheet-50-sheets-pack-of-2/prid/484219,Classmate Unruled A4 Sheet (50 Sheets) Pack of 2,Classmate,484219,Buy Classmate Unruled A4 Sheet (50 Sheets) Pack of 2 online in India at lowest price and get super fast home delivery with easy returns. Available in  2 x 50 sheets,98,INR,OutOfStock,blinkit.com,484219,"https://cdn.grofers.com/cdn-cgi/image/f=auto,fit=scale-down,q=85,metadata=none,w=600,h=600/app/images/products/full_screen/pro_484219.jpg?ts=1684833378 | https://cdn.grofers.com/cdn-cgi/image/f=auto,fit=scale-down,q=85,metadata=none,w=600,h=600/app/images/products/sliding_image/484219a.jpg?ts=1690808704 | https://cdn.grofers.com/cdn-cgi/image/f=auto,fit=scale-down,q=85,metadata=none,w=600,h=600/app/images/products/sliding_image/484219b.jpg?ts=1690808704 | https://cdn.grofers.com/cdn-cgi/image/f=auto,fit=scale-down,q=85,metadata=none,w=600,h=600/app/images/products/sliding_image/484219c.jpg?ts=1690808704 | https://cdn.grofers.com/cdn-cgi/image/f=auto,fit=scale-down,q=85,metadata=none,w=600,h=600/app/images/products/sliding_image/484219d.jpg?ts=1690808704 | https://cdn.grofers.com/cdn-cgi/image/f=auto,fit=scale-down,q=85,metadata=none,w=600,h=600/app/images/products/sliding_image/484219e.jpg?ts=1690808704 | https://cdn.grofers.com/cdn-cgi/image/f=auto,fit=scale-down,q=85,metadata=none,w=600,h=600/app/images/products/common/customer_care.jpg","[{'Key Features': 'Thick paperSuperior quality pages'}, {'Model Name': '2001240 75 GSM A4'}, {'Pages': '50 Sheets'}, {'Ruling': 'Unruled'}, {'Size': 'A4, 75 GSM'}, {'Unit': '2 x 1 unit'}, {'Dimensions (cm)': '30 cm x 21 cm'}, {'Manufacturer Details': 'Dinakar Process Pvt. Ltd-NBFT-Survey No 595/A, Gollapudi Village & Post Vijayawada rural mandal, Krishna Dist.., Pin-521225 , Andhra Pradesh'}, {'Marketed By': 'ITC LTD.'}, {'Country of Origin': 'India'}, {'Customer Care Details': 'Email: info@blinkit.com'}, {'Return Policy': 'This Item is non-returnable. For a damaged, defective, incorrect or expired item, you can request a replacement within 72 hours of delivery. In case of an incorrect item, you may raise a replacement or return request only if the item is sealed/ unopened/ unused and in original condition.'}, {'Offer': 'Pack of 2'}, {'Expiry Date': 'Please refer to the packaging of the product for expiry date.'}, {'Disclaimer': 'Every effort is made to maintain accuracy of all information. However, actual product packaging and materials may contain more and/or different information. The color of the product displayed in the image may differ from that received in the order. It is recommended not to solely rely on the details presented.'}]",,d8520c95-d246-5594-99c4-7ca63100b725,19/11/2023 18:09:32
https://blinkit.com/prn/fiama-menthol-magnolia-gel-bathing-bar-pack-of-2/prid/489775,Fiama Menthol & Magnolia Gel Bathing Bar - Pack of 2,Fiama,489775,Buy Fiama Menthol & Magnolia Gel Bathing Bar - Pack of 2 online in India at lowest price and get super fast home delivery with easy returns. Available in  2 x (3 x 125 g),150,INR,OutOfStock,blinkit.com,489775,"https://cdn.grofers.com/cdn-cgi/image/f=auto,fit=scale-down,q=85,metadata=none,w=600,h=600/app/images/products/full_screen/pro_489775.jpg?ts=1685981543 | https://cdn.grofers.com/cdn-cgi/image/f=auto,fit=scale-down,q=85,metadata=none,w=600,h=600/app/images/products/sliding_image/489775a.jpg | https://cdn.grofers.com/cdn-cgi/image/f=auto,fit=scale-down,q=85,metadata=none,w=600,h=600/app/images/products/sliding_image/489775b.jpg | https://cdn.grofers.com/cdn-cgi/image/f=auto,fit=scale-down,q=85,metadata=none,w=600,h=600/app/images/products/sliding_image/489775c.jpg | https://cdn.grofers.com/cdn-cgi/image/f=auto,fit=scale-down,q=85,metadata=none,w=600,h=600/app/images/products/sliding_image/489775d.jpg | https://cdn.grofers.com/cdn-cgi/image/f=auto,fit=scale-down,q=85,metadata=none,w=600,h=600/app/images/products/sliding_image/489775e.jpg | https://cdn.grofers.com/cdn-cgi/image/f=auto,fit=scale-down,q=85,metadata=none,w=600,h=600/app/images/products/sliding_image/489775f.jpg | https://cdn.grofers.com/cdn-cgi/image/f=auto,fit=scale-down,q=85,metadata=none,w=600,h=600/app/images/products/common/customer_care.jpg","[{'Key Features': 'Cooling and refreshing gel bar.With skin conditioners.Dermatologically tested safe to human skin.'}, {'Ingredients': 'Sodium salts of Fatty Acids, Aqua, Propylene Glycol, Sodium Laureth Sulfate, Sorbitol, Glycerin, PEG-8, Fragrance with Magnolia Extract, Sodium Chloride, Menthol, Acetic Acid, Tetrasodium EDTA, Tetrasodium Etidronate, BHT, Benzyl Alcohol, Benzyl Benzoate, Limonene, Linalool, Calcium Aluminium Borosilicate CI 77891, Silica, Tin oxide, CI 74160'}, {'Packaging Type': 'Box'}, {'Unit': '2 x (3 x 125 g)'}, {'Preferences': 'Vegan, Silicone-Free'}, {'Offer': 'Pack of 2'}, {'Contents': 'Gel Bar - 3 units'}, {'Shelf Life': '36 months'}, {'Manufacturer Details': '1.) ITC Ltd. Plot No.1, sector 11, IIE Ranipur, Haridwar, Uttarakhand-249403 2.) ITC Ltd. Manipura, Baddi, Solan, Himachal Pradesh-174101'}, {'Marketed By': 'ITC LTD, 37, J.L. Nehru Road, Kolkata - 7000 71, West Bengal'}, {'Country of Origin': 'India'}, {'Customer Care Details': 'Email: info@blinkit.com'}, {'Return Policy': 'This Item is non-returnable. For a damaged, defective, incorrect or expired item, you can request a replacement within 72 hours of delivery. In case of an incorrect item, you may raise a replacement or return request only if the item is sealed/ unopened/ unused and in original condition.'}, {'Expiry Date': 'Please refer to the packaging of the product for expiry date.'}, {'Disclaimer': 'Every effort is made to maintain the accuracy of all information. However, actual product packaging and materials may contain more and/or different information. The color of the product displayed in the image may differ from that received in the order. It is recommended not to solely rely on the details presented.'}]",,73882f43-d219-5012-b8f4-cc9776007244,19/11/2023 18:09:34
https://blinkit.com/prn/sting-energy-drink/prid/374685,Sting Energy Drink,Sting,374685,Buy Sting Energy Drink online in India at lowest price and get super fast home delivery with easy returns. Available in  250 ml,35,INR,OutOfStock,blinkit.com,374685,"https://cdn.grofers.com/cdn-cgi/image/f=auto,fit=scale-down,q=85,metadata=none,w=600,h=600/app/images/products/full_screen/pro_374685.jpg?ts=1684835623 | https://cdn.grofers.com/cdn-cgi/image/f=auto,fit=scale-down,q=85,metadata=none,w=600,h=600/app/images/products/sliding_image/374685a.jpg?ts=1688973588 | https://cdn.grofers.com/cdn-cgi/image/f=auto,fit=scale-down,q=85,metadata=none,w=600,h=600/app/images/products/sliding_image/374685b.jpg?ts=1560326417 | https://cdn.grofers.com/cdn-cgi/image/f=auto,fit=scale-down,q=85,metadata=none,w=600,h=600/app/images/products/sliding_image/374685c.jpg?ts=1560326417 | https://cdn.grofers.com/cdn-cgi/image/f=auto,fit=scale-down,q=85,metadata=none,w=600,h=600/app/images/products/sliding_image/374685d.jpg?ts=1560326417 | https://cdn.grofers.com/cdn-cgi/image/f=auto,fit=scale-down,q=85,metadata=none,w=600,h=600/app/images/products/sliding_image/374685e.jpg?ts=1560326417 | https://cdn.grofers.com/cdn-cgi/image/f=auto,fit=scale-down,q=85,metadata=none,w=600,h=600/app/images/products/sliding_image/374685f.jpg | https://cdn.grofers.com/cdn-cgi/image/f=auto,fit=scale-down,q=85,metadata=none,w=600,h=600/app/images/products/common/customer_care.jpg","[{'Key Features': 'An energy drink with amazingly refreshing tasteIt contains caffeine, tourine and B-vitamins that stimulates the mind and energizes the bodyAlso invigorates your taste buds with its refreshingly delicious flavour'}, {'Unit': '250 ml'}, {'Packaging Type': 'Can'}, {'Shelf Life': '9 months'}, {'Manufacturer Details': 'For Manufacturing Unit address See first two letters before batch number and see below : AE) PepsiCo India Holdings Pvt. Ltd., 100/1, A Road, MIDC, Dhatav- Roha, Distt. Raigad, Maharashtra 402116, India, CDV 938. AN) PepsiCo India Holdings Pvt. Ltd. 3010 Peepul boulevard, Sector 40, Sri City, Satyavedu Mandal, Chittoor District, Andhra Pradesh, 517588, CDV : 7116'}, {'Country of Origin': 'India'}, {'Customer Care Details': 'Email: info@blinkit.com'}, {'Return Policy': 'This Item is non-returnable. For a damaged, defective, incorrect or expired item, you can request a replacement within 72 hours of delivery. In case of an incorrect item, you may raise a replacement or return request only if the item is sealed/ unopened/ unused and in original condition.'}, {'Expiry Date': 'Please refer to the packaging of the product for expiry date.'}, {'Disclaimer': 'Every effort is made to maintain the accuracy of all information. However, actual product packaging and materials may contain more and/or different information. It is recommended not to solely rely on the information presented.'}]",,3b921636-37b9-51a0-a50e-9c25e304285c,19/11/2023 18:09:35
https://blinkit.com/prn/maggi-magic-cubes-sabzi-masala/prid/429977,Maggi Magic Cubes Sabzi Masala,Maggi,429977,Buy Maggi Magic Cubes Sabzi Masala online in India at lowest price and get super fast home delivery with easy returns. Available in  240 g,190,INR,OutOfStock,blinkit.com,429977,"https://cdn.grofers.com/cdn-cgi/image/f=auto,fit=scale-down,q=85,metadata=none,w=600,h=600/app/images/products/full_screen/pro_429977.jpg?ts=1685980310 | https://cdn.grofers.com/cdn-cgi/image/f=auto,fit=scale-down,q=85,metadata=none,w=600,h=600/app/images/products/sliding_image/429977a.jpg?ts=1688444555 | https://cdn.grofers.com/cdn-cgi/image/f=auto,fit=scale-down,q=85,metadata=none,w=600,h=600/app/images/products/sliding_image/429977b.jpg | https://cdn.grofers.com/cdn-cgi/image/f=auto,fit=scale-down,q=85,metadata=none,w=600,h=600/app/images/products/sliding_image/429977c.jpg | https://cdn.grofers.com/cdn-cgi/image/f=auto,fit=scale-down,q=85,metadata=none,w=600,h=600/app/images/products/sliding_image/429977d.jpg | https://cdn.grofers.com/cdn-cgi/image/f=auto,fit=scale-down,q=85,metadata=none,w=600,h=600/app/images/products/sliding_image/429977e.jpg | https://cdn.grofers.com/cdn-cgi/image/f=auto,fit=scale-down,q=85,metadata=none,w=600,h=600/app/images/products/sliding_image/429977f.jpg | https://cdn.grofers.com/cdn-cgi/image/f=auto,fit=scale-down,q=85,metadata=none,w=600,h=600/app/images/products/sliding_image/429977g.jpg | https://cdn.grofers.com/cdn-cgi/image/f=auto,fit=scale-down,q=85,metadata=none,w=600,h=600/app/images/products/common/customer_care.jpg","[{'Key Features': 'Made up of choicest ingredientsHealthy and tasty100 per cent vegetarianCrumble a cube and make your rice, pulses, and vegetables tastier than before.'}, {'Shelf Life': '12 Months'}, {'Unit': '240 g'}, {'Packaging Type': 'Pouch'}, {'Manufacturer Details': 'Nestle India Ltd.Ludhiana-Ferozepur Road, Moga-142001, Punjab'}, {'Marketed By': 'Nestlé India Ltd., 100/101, World Trade Centre, Barakhamba Lane, New Delhi - 110001'}, {'Country of Origin': 'India'}, {'Customer Care Details': 'Email: info@blinkit.com'}, {'Return Policy': 'This Item is non-returnable. For a damaged, defective, incorrect or expired item, you can request a replacement within 72 hours of delivery. In case of an incorrect item, you may raise a replacement or return request only if the item is sealed/ unopened/ unused and in original condition.'}, {'Expiry Date': 'Please refer to the packaging of the product for expiry date.'}, {'Disclaimer': 'Every effort is made to maintain the accuracy of all information. However, actual product packaging and materials may contain more and/or different information. It is recommended not to solely rely on the information presented.'}]",,e13705e2-0e1e-56e3-81e7-d7489d517e52,19/11/2023 18:09:36
https://blinkit.com/prn/worldone-executive-series-journal-notebook-sea-green/prid/485986,Worldone Executive Series Journal Notebook (Sea Green),Worldone,485986,Buy Worldone Executive Series Journal Notebook (Sea Green) online in India at lowest price and get super fast home delivery with easy returns. Available in  1 piece,225,INR,OutOfStock,blinkit.com,485986,"https://cdn.grofers.com/cdn-cgi/image/f=auto,fit=scale-down,q=85,metadata=none,w=600,h=600/app/images/products/full_screen/pro_485986.jpg?ts=1685981571 | https://cdn.grofers.com/cdn-cgi/image/f=auto,fit=scale-down,q=85,metadata=none,w=600,h=600/app/images/products/sliding_image/485986a.jpg?ts=1686565290 | https://cdn.grofers.com/cdn-cgi/image/f=auto,fit=scale-down,q=85,metadata=none,w=600,h=600/app/images/products/sliding_image/485986b.jpg | https://cdn.grofers.com/cdn-cgi/image/f=auto,fit=scale-down,q=85,metadata=none,w=600,h=600/app/images/products/sliding_image/485986c.jpg | https://cdn.grofers.com/cdn-cgi/image/f=auto,fit=scale-down,q=85,metadata=none,w=600,h=600/app/images/products/sliding_image/485986d.jpg | https://cdn.grofers.com/cdn-cgi/image/f=auto,fit=scale-down,q=85,metadata=none,w=600,h=600/app/images/products/common/customer_care.jpg","[{'Key Features': 'Premium soft cover.Comes with a pen holder.Strong button lock.Perfect Finishing.'}, {'Colour': 'Sea Green'}, {'Unit': '1 piece'}, {'Packaging Type': 'Pack'}, {'Country of Origin': 'India'}, {'Customer Care Details': 'Email: info@blinkit.com'}, {'Return Policy': 'This Item is non-returnable. For a damaged, defective, incorrect or expired item, you can request a replacement within 72 hours of delivery. In case of an incorrect item, you may raise a replacement or return request only if the item is sealed/ unopened/ unused and in original condition.'}, {'Expiry Date': 'Please refer to the packaging of the product for expiry date.'}, {'Disclaimer': 'Every effort is made to maintain accuracy of all information. However, actual product packaging and materials may contain more and/or different information. The color of the product displayed in the image may differ from that received in the order. It is recommended not to solely rely on the details presented.'}]",,12554fe9-3802-5be6-911e-df28716bc7e7,19/11/2023 18:09:36
https://blinkit.com/prn/swach-premium-quality-poha/prid/521235,Swach Premium Quality Poha,Swach,521235,"Poha is a rice flake that is often consumed as a snack or breakfast in different parts of India. It is one of the most healthy snacks as it makes your brain cells more attentive and also improves the metabolism. And one such healthy breakfast in the Indian Poha. Now making savory breakfast is simpler than ever. With Swach Premium Poha, you can make any breakfast recipe in a matter of minutes! Delicious, healthy, and sumptuous.",1,INR,OutOfStock,blinkit.com,521235,"https://cdn.grofers.com/cdn-cgi/image/f=auto,fit=scale-down,q=85,metadata=none,w=600,h=600/app/images/products/full_screen/pro_521235.jpg?ts=1685980469 | https://cdn.grofers.com/cdn-cgi/image/f=auto,fit=scale-down,q=85,metadata=none,w=600,h=600/app/images/products/sliding_image/521235a.jpg | https://cdn.grofers.com/cdn-cgi/image/f=auto,fit=scale-down,q=85,metadata=none,w=600,h=600/app/images/products/sliding_image/521235b.jpg | https://cdn.grofers.com/cdn-cgi/image/f=auto,fit=scale-down,q=85,metadata=none,w=600,h=600/app/images/products/sliding_image/521235c.jpg | https://cdn.grofers.com/cdn-cgi/image/f=auto,fit=scale-down,q=85,metadata=none,w=600,h=600/app/images/products/sliding_image/521235d.jpg | https://cdn.grofers.com/cdn-cgi/image/f=auto,fit=scale-down,q=85,metadata=none,w=600,h=600/app/images/products/common/customer_care.jpg","[{'Key Features': 'Makes everyday cooking easy.Superior quality product.No colors added 100% pure & natural.'}, {'Shelf Life': '6 months'}, {'Unit': '500 g'}, {'Ingredients': 'Poha'}, {'Nutrition Information': 'Average Nutritional Value As Per 100g - Calories - 394Kcal, Total Fat - 1.3g, Saturated Fat - 0.4g, Sodium - 545 mg, Total Carbohydrate - 86g, Dietary Fibre 0.7g, Sugar - 12g, Protein- 6.7g, Vitamin D -7.60mcg, Calcium - 5.00mg, Iron - 32.73mg, Potassium - 106mg'}, {'Storage Tips': 'Store in a cool dry place, away from sunlight.'}, {'Packaging Type': 'Packet'}, {'Manufacturer Details': 'ATC Food Products, 10 Noor Mahal Road, Chowki Imambada, Bhopal- 462001 Madhya Pradesh, India'}, {'Marketed By': 'ATC Food Products, 10 Noor Mahal Road, Chowki Imambada, Bhopal- 462001 Madhya Pradesh, India'}, {'FSSAI License': '11414010001802'}, {'Country of Origin': 'India'}, {'Customer Care Details': 'Email: info@blinkit.com'}, {'Return Policy': 'This Item is non-returnable. For a damaged, defective, incorrect or expired item, you can request a replacement within 72 hours of delivery. In case of an incorrect item, you may raise a replacement or return request only if the item is sealed/ unopened/ unused and in original condition.'}, {'Description': 'Poha is a rice flake that is often consumed as a snack or breakfast in different parts of India. It is one of the most healthy snacks as it makes your brain cells more attentive and also improves the metabolism. And one such healthy breakfast in the Indian Poha. Now making savory breakfast is simpler than ever. With Swach Premium Poha, you can make any breakfast recipe in a matter of minutes! Delicious, healthy, and sumptuous.'}, {'Disclaimer': 'Every effort is made to maintain accuracy of all information. However, actual product packaging and materials may contain more and/or different information. It is recommended not to solely rely on the information presented.'}]",,8307a355-0cb5-51b7-90cc-4deb1af61cdb,19/11/2023 18:10:18
https://blinkit.com/prn/savemore-multicolor-printed-3d-double-bedsheet-set-poly-104-tc/prid/409085,"SaveMore Multicolor Printed 3D Double Bedsheet Set (Poly, 104 TC)",SaveMore,409085,"Buy SaveMore Multicolor Printed 3D Double Bedsheet Set (Poly, 104 TC) online in India at lowest price and get super fast home delivery with easy returns. Available in  1 unit",799,INR,OutOfStock,blinkit.com,409085,"https://cdn.grofers.com/cdn-cgi/image/f=auto,fit=scale-down,q=85,metadata=none,w=600,h=600/app/images/products/full_screen/pro_409085.jpg?ts=1686022838 | https://cdn.grofers.com/cdn-cgi/image/f=auto,fit=scale-down,q=85,metadata=none,w=600,h=600/app/images/products/sliding_image/409085a.jpg?ts=1696411779 | https://cdn.grofers.com/cdn-cgi/image/f=auto,fit=scale-down,q=85,metadata=none,w=600,h=600/app/images/products/sliding_image/409085b.jpg?ts=1621406411 | https://cdn.grofers.com/cdn-cgi/image/f=auto,fit=scale-down,q=85,metadata=none,w=600,h=600/app/images/products/sliding_image/409085c.jpg?ts=1621406411 | https://cdn.grofers.com/cdn-cgi/image/f=auto,fit=scale-down,q=85,metadata=none,w=600,h=600/app/images/products/sliding_image/409085d.jpg?ts=1621406411 | https://cdn.grofers.com/cdn-cgi/image/f=auto,fit=scale-down,q=85,metadata=none,w=600,h=600/app/images/products/sliding_image/409085e.jpg?ts=1621406411 | https://cdn.grofers.com/cdn-cgi/image/f=auto,fit=scale-down,q=85,metadata=none,w=600,h=600/app/images/products/sliding_image/409085f.jpg?ts=1621406411 | https://cdn.grofers.com/cdn-cgi/image/f=auto,fit=scale-down,q=85,metadata=none,w=600,h=600/app/images/products/sliding_image/409085g.jpg?ts=1621406411 | https://cdn.grofers.com/cdn-cgi/image/f=auto,fit=scale-down,q=85,metadata=none,w=600,h=600/app/images/products/sliding_image/409085h.jpg?ts=1690019766 | https://cdn.grofers.com/cdn-cgi/image/f=auto,fit=scale-down,q=85,metadata=none,w=600,h=600/app/images/products/common/customer_care.jpg","[{'Multicolor': 'Colour'}, {'Poly': 'Fabric'}, {'104 TC': 'Thread Count'}, {'Printed': 'Design'}, {'Tulip EWB0142': 'Collection Name'}, {'Pillow Covers': '2 Pillow Covers'}, {'Box Contents': 'Double Bedsheet - 1 unit'}, {'Product Length (cm)': '240'}, {'Product Width (cm)': '215'}, {'Pillow Length (cm)': '46'}, {'Pillow Width (cm)': '68'}, {'Packed Product Length (cm)': '30'}, {'Packed Product Width (cm)': '23'}, {'Packed Product Height (cm)': '3'}, {'Weight (gm)': '700'}, {'Country of Origin': 'India'}, {'Customer Care Details': 'Email: info@blinkit.com'}, {'Return Policy': 'This Item is non-returnable. For a damaged, defective, incorrect or expired item, you can request a replacement within 72 hours of delivery. In case of an incorrect item, you may raise a replacement or return request only if the item is sealed/ unopened/ unused and in original condition.'}, {'Description': 'Machine Wash:- ColdBleach:- Don not useDrying Instructions:- Line Dry in shadeIroning:- Iron on medium heat settingDry Colors:- Wash dark colours and print separately'}, {'Disclaimer': 'Every effort is made to maintain the accuracy of all information. However, actual product packaging and materials may contain more and/or different information. The color of the product displayed in the image may differ from that received in the order. It is recommended not to solely rely on the details presented.'}]",,daa229b6-ab03-57cd-a95a-2a53ba74be05,19/11/2023 18:10:23
