url,name,brand,sku,description,price,currency,availability,source,pid,images,product_details,breads,uniq_id,scraped_at
https://blinkit.com/prn/everyuth-walnut-exfoliating-face-scrub/prid/35358,Everyuth Walnut Exfoliating Face Scrub (200 g),Everyuth,35358,"New Exfoliating Walnut Scrub has natural Walnut Shell Particles and Nano Multi-Vita, Natural Walnut Shell Particles exfoliate dead skin cells and skin impurities.
How to use?
Wet your face.
 Apply scrub and gently massage your skin with brisk circular movements for about 2 minutes, concentrating on areas such as nose and chin for blackhead removal. Avoid any contact with eye area. Rinse and pat dry.",234,INR,OutOfStock,blinkit.com,35358,"https://cdn.grofers.com/cdn-cgi/image/f=auto,fit=scale-down,q=85,metadata=none,w=600,h=600/app/images/products/full_screen/pro_35358.jpg?ts=1685981561 | https://cdn.grofers.com/cdn-cgi/image/f=auto,fit=scale-down,q=85,metadata=none,w=600,h=600/app/images/products/sliding_image/35358a.jpg?ts=1687436958 | https://cdn.grofers.com/cdn-cgi/image/f=auto,fit=scale-down,q=85,metadata=none,w=600,h=600/app/images/products/sliding_image/35358b.jpg?ts=1611039285 | https://cdn.grofers.com/cdn-cgi/image/f=auto,fit=scale-down,q=85,metadata=none,w=600,h=600/app/images/products/sliding_image/35358c.jpg?ts=1611039285 | https://cdn.grofers.com/cdn-cgi/image/f=auto,fit=scale-down,q=85,metadata=none,w=600,h=600/app/images/products/sliding_image/35358d.jpg?ts=1611039285 | https://cdn.grofers.com/cdn-cgi/image/f=auto,fit=scale-down,q=85,metadata=none,w=600,h=600/app/images/products/sliding_image/35358e.jpg?ts=1611039285 | https://cdn.grofers.com/cdn-cgi/image/f=auto,fit=scale-down,q=85,metadata=none,w=600,h=600/app/images/products/sliding_image/35358f.jpg | https://cdn.grofers.com/cdn-cgi/image/f=auto,fit=scale-down,q=85,metadata=none,w=600,h=600/app/images/products/sliding_image/35358g.jpg | https://cdn.grofers.com/cdn-cgi/image/f=auto,fit=scale-down,q=85,metadata=none,w=600,h=600/app/images/products/sliding_image/35358h.jpg | https://cdn.grofers.com/cdn-cgi/image/f=auto,fit=scale-down,q=85,metadata=none,w=600,h=600/app/images/products/sliding_image/35358i.jpg | https://cdn.grofers.com/cdn-cgi/image/f=auto,fit=scale-down,q=85,metadata=none,w=600,h=600/app/images/products/common/customer_care.jpg","[{'Key Features': 'Everyuth Naturals Walnut Scrub made with walnut shell helps in exfoliating dead skin cellsNano Multi-Vita in the scrub helps in nourishing and revitalizing the skinThe scrub’s deep pore-cleansing action helps removing black head causing impuritiesLeaves your skin clean, clear and beautifulSuitable for all skin types'}, {'Unit': '200 g'}, {'Shelf Life': '36 months'}, {'Manufacturer Details': 'Zydus Wellness Sikkim - Mamring Forest Block, Sikkim 737132'}, {'Marketed By': 'Zydus Wellness Ltd. House No. 6 & 7, Sigma Commerce Zone, Nr. Iskcon Temple, S. G. Highway, Ahmedabad-380015, Gujarat, India'}, {'Country of Origin': 'India'}, {'Customer Care Details': 'Email: info@blinkit.com'}, {'Return Policy': 'This Item is non-returnable. For a damaged, defective, incorrect or expired item, you can request a replacement within 72 hours of delivery. In case of an incorrect item, you may raise a replacement or return request only if the item is sealed/ unopened/ unused and in original condition.'}, {'Expiry Date': 'Please refer to the packaging of the product for expiry date.'}, {'Description': 'New Exfoliating Walnut Scrub has natural Walnut Shell Particles and Nano Multi-Vita, Natural Walnut Shell Particles exfoliate dead skin cells and skin impurities.How to use?Wet your face. Apply scrub and gently massage your skin with brisk circular movements for about 2 minutes, concentrating on areas such as nose and chin for blackhead removal. Avoid any contact with eye area. Rinse and pat dry.'}, {'Disclaimer': 'Every effort is made to maintain the accuracy of all information. However, actual product packaging and materials may contain more and/or different information. The color of the product displayed in the image may differ from that received in the order. It is recommended not to solely rely on the details presented.'}]",Face Wash & Scrub,6550ae83-9e3a-5b03-aebc-ca8e5fb4103c,19/11/2023 18:12:55
https://blinkit.com/prn/wonderize-ultra-dry-sanitary-pads-xl/prid/467420,Wonderize Ultra Dry Sanitary Pads (XL),Wonderize,467420,The Wonderize Ultra Dry extra large Sanitary Pads with size 310mm caters to the woman for a comfortable all-night sleep and the workaholic who won't take a day off even during heavy flow. These sanitary pads are designed according to the Indian weather condition to provide you comfortable and rash free experience.,330,INR,OutOfStock,blinkit.com,467420,"https://cdn.grofers.com/cdn-cgi/image/f=auto,fit=scale-down,q=85,metadata=none,w=600,h=600/app/images/products/full_screen/pro_467420.jpg?ts=1685984356 | https://cdn.grofers.com/cdn-cgi/image/f=auto,fit=scale-down,q=85,metadata=none,w=600,h=600/app/images/products/sliding_image/467420a.jpg?ts=1696394679 | https://cdn.grofers.com/cdn-cgi/image/f=auto,fit=scale-down,q=85,metadata=none,w=600,h=600/app/images/products/sliding_image/467420b.jpg?ts=1658478210 | https://cdn.grofers.com/cdn-cgi/image/f=auto,fit=scale-down,q=85,metadata=none,w=600,h=600/app/images/products/sliding_image/467420c.jpg?ts=1658478210 | https://cdn.grofers.com/cdn-cgi/image/f=auto,fit=scale-down,q=85,metadata=none,w=600,h=600/app/images/products/sliding_image/467420d.jpg?ts=1658478210 | https://cdn.grofers.com/cdn-cgi/image/f=auto,fit=scale-down,q=85,metadata=none,w=600,h=600/app/images/products/sliding_image/467420e.jpg | https://cdn.grofers.com/cdn-cgi/image/f=auto,fit=scale-down,q=85,metadata=none,w=600,h=600/app/images/products/sliding_image/467420f.jpg | https://cdn.grofers.com/cdn-cgi/image/f=auto,fit=scale-down,q=85,metadata=none,w=600,h=600/app/images/products/sliding_image/467420g.jpg | https://cdn.grofers.com/cdn-cgi/image/f=auto,fit=scale-down,q=85,metadata=none,w=600,h=600/app/images/products/sliding_image/467420h.jpg | https://cdn.grofers.com/cdn-cgi/image/f=auto,fit=scale-down,q=85,metadata=none,w=600,h=600/app/images/products/sliding_image/467420i.jpg | https://cdn.grofers.com/cdn-cgi/image/f=auto,fit=scale-down,q=85,metadata=none,w=600,h=600/app/images/products/sliding_image/467420j.jpg | https://cdn.grofers.com/cdn-cgi/image/f=auto,fit=scale-down,q=85,metadata=none,w=600,h=600/app/images/products/sliding_image/467420k.jpg | https://cdn.grofers.com/cdn-cgi/image/f=auto,fit=scale-down,q=85,metadata=none,w=600,h=600/app/images/products/sliding_image/467420l.jpg | https://cdn.grofers.com/cdn-cgi/image/f=auto,fit=scale-down,q=85,metadata=none,w=600,h=600/app/images/products/common/customer_care.jpg","[{'Key Features': '310mm length and 40% longer wider back provides 3X better coverage and protects against leakage. An embedded anion strip gives anti-bacterial protection. Soft cotton top sheet with super soft side edges prevents rashes and irritation. Super gel technology with 3D funnel-shaped holes quickly draws in and locks away wetness.'}, {'Box Contents': 'Sanitary Pads - 30 units'}, {'Packaging Type': 'Poly Packaging'}, {'Unit': '1 pack (30 pieces)'}, {'Preferences': 'Natural'}, {'Shelf Life': '36 months'}, {'Manufacturer Details': 'Sekhani Industries Private Limited Plot No : SM -11. GIDC, Sanand-II (BOL) Ind. Estate, Tal. Sanand, Dist. Ahmedabad, Gujarat-382210, India.'}, {'Marketed By': 'Sekhani Industries Private Limited Plot No : SM -11. GIDC, Sanand-II (BOL) Ind. Estate, Tal. Sanand, Dist. Ahmedabad, Gujarat-382210, India.'}, {'Country of Origin': 'India'}, {'Customer Care Details': 'Email: info@blinkit.com'}, {'Return Policy': 'This Item is non-returnable. For a damaged, defective, incorrect or expired item, you can request a replacement within 72 hours of delivery. In case of an incorrect item, you may raise a replacement or return request only if the item is sealed/ unopened/ unused and in original condition.'}, {'Expiry Date': 'Please refer to the packaging of the product for expiry date.'}, {'Description': ""The Wonderize Ultra Dry extra large Sanitary Pads with size 310mm caters to the woman for a comfortable all-night sleep and the workaholic who won't take a day off even during heavy flow. These sanitary pads are designed according to the Indian weather condition to provide you comfortable and rash free experience.""}, {'Disclaimer': 'Every effort is made to maintain the accuracy of all information. However, actual product packaging and materials may contain more and/or different information. The color of the product displayed in the image may differ from that received in the order. It is recommended not to solely rely on the details presented.'}]",,2791b35c-3208-5459-acda-f79b04e6582e,19/11/2023 18:12:56
https://blinkit.com/prn/winkies-novo-vanilla-cake/prid/512744,Winkies Novo Vanilla Cake,Winkies,512744,"The mouth-watering cake with vanilla cream fillings, which makes it soft and moist with a twist. It is perfectly baked and has a layer of creme filling and is enveloped with a fudge coating. Enjoy the vanilla cream fillings and make your tea-time heaven. This delicious snack can be relished by adults and children. Share it with your family and friends and pull out a sweet note together.",120,INR,OutOfStock,blinkit.com,512744,"https://cdn.grofers.com/cdn-cgi/image/f=auto,fit=scale-down,q=85,metadata=none,w=600,h=600/app/images/products/full_screen/pro_512744.jpg?ts=1685979947 | https://cdn.grofers.com/cdn-cgi/image/f=auto,fit=scale-down,q=85,metadata=none,w=600,h=600/app/images/products/sliding_image/512744a.jpg?ts=1679397054 | https://cdn.grofers.com/cdn-cgi/image/f=auto,fit=scale-down,q=85,metadata=none,w=600,h=600/app/images/products/sliding_image/512744b.jpg?ts=1679397054 | https://cdn.grofers.com/cdn-cgi/image/f=auto,fit=scale-down,q=85,metadata=none,w=600,h=600/app/images/products/sliding_image/512744c.jpg?ts=1679397054 | https://cdn.grofers.com/cdn-cgi/image/f=auto,fit=scale-down,q=85,metadata=none,w=600,h=600/app/images/products/sliding_image/512744d.jpg?ts=1679397054 | https://cdn.grofers.com/cdn-cgi/image/f=auto,fit=scale-down,q=85,metadata=none,w=600,h=600/app/images/products/sliding_image/512744e.jpg?ts=1679397054 | https://cdn.grofers.com/cdn-cgi/image/f=auto,fit=scale-down,q=85,metadata=none,w=600,h=600/app/images/products/sliding_image/512744f.jpg?ts=1679397054 | https://cdn.grofers.com/cdn-cgi/image/f=auto,fit=scale-down,q=85,metadata=none,w=600,h=600/app/images/products/common/customer_care.jpg","[{'Key Features': 'Cake with vanilla cream fillings within the wafer.The wafer and the smooth creamy flavor of the vanilla cream.The mouth-watering cake with vanilla cream filling.'}, {'Ingredients': 'Cake (79%): Refined Wheat Flour (Maida), Sugar, Palmolein Oil, Vanilla Concentrate (Milk Solids, Leavening Agents [INS 500(11), INS 341(I)], Humectant (INS 422), Cake Gel (INS 471, INS 477, INS 1520, INS 420, INS 412, INS 202), Artificial Flavour (Vanilla), Edible Common Salt, Acidity Regulator (INS 260) And Preservatives (INS 282, INS 200). Filing (210%): Sugar, Water, Palm Oil, Milk Solids (4%), Margarine, Modified Starch (INS 1412, INS 1440, INS 1442), Thickener [INS 440(I)], Artificial Colour (INS 171), Artificial Flavour (Vanilla), Preservative (INS 202), Acidity Regulator (INS 330) And Edible Common Salt.'}, {'Packaging Type': 'Box'}, {'Storage Tips': 'Store under cool, dry and hygienic conditions, away from sunlight.'}, {'Nutrition Information': 'Average Nutritional Value As Per 100g, Energy - 370.5 Kcal, Carbohydrates - 59.9g, Total Sugar - 25.7g, Added Sugar - 24.9g, Protein - 5.5g, Total Fat - 12.0g, Saturated Fat - 5.8g, Trans Fat - 0.01g, Sodium - 435.2mg, Cholesterol - 41.2mg'}, {'Size': '198 g'}, {'Pack Size': '6 pieces'}, {'Shelf Life': '6 months'}, {'Manufacturer Details': 'Dream Bake Private Limited Registered Office: 296, Kalukhan Road, P.O. Boral, Dist.: 24 Parganas (South), P.S. Sonarpur, Pin-700 154, West Bengal.'}, {'Marketed By': 'Dream Bake Private Limited Registered Office: 296, Kalukhan Road, P.O. Boral, Dist.: 24 Parganas (South), P.S. Sonarpur, Pin-700 154, West Bengal.'}, {'FSSAI License': '10012031000036'}, {'Country of Origin': 'India'}, {'Customer Care Details': 'Email: info@blinkit.com'}, {'Return Policy': 'This Item is non-returnable. For a damaged, defective, incorrect or expired item, you can request a replacement within 72 hours of delivery. In case of an incorrect item, you may raise a replacement or return request only if the item is sealed/ unopened/ unused and in original condition.'}, {'Description': 'The mouth-watering cake with vanilla cream fillings, which makes it soft and moist with a twist. It is perfectly baked and has a layer of creme filling and is enveloped with a fudge coating. Enjoy the vanilla cream fillings and make your tea-time heaven. This delicious snack can be relished by adults and children. Share it with your family and friends and pull out a sweet note together.'}, {'Disclaimer': 'Every effort is made to maintain accuracy of all information. However, actual product packaging and materials may contain more and/or different information. It is recommended not to solely rely on the information presented'}]",Biscuit Gift Pack,49b02d3c-f6bc-5c1f-90a9-71257545c459,19/11/2023 18:12:57
https://blinkit.com/prn/makino-tomato-salsa-nacho-chips-pack-of-2/prid/491635,Makino Tomato Salsa Nacho Chips - Pack of 2,Makino,491635,Buy Makino Tomato Salsa Nacho Chips - Pack of 2 online in India at lowest price and get super fast home delivery with easy returns. Available in  2 x 150 g,1,INR,OutOfStock,blinkit.com,491635,"https://cdn.grofers.com/cdn-cgi/image/f=auto,fit=scale-down,q=85,metadata=none,w=600,h=600/app/images/products/full_screen/pro_491635.jpg?ts=1684832276 | https://cdn.grofers.com/cdn-cgi/image/f=auto,fit=scale-down,q=85,metadata=none,w=600,h=600/app/images/products/sliding_image/491635a.jpg | https://cdn.grofers.com/cdn-cgi/image/f=auto,fit=scale-down,q=85,metadata=none,w=600,h=600/app/images/products/sliding_image/491635b.jpg | https://cdn.grofers.com/cdn-cgi/image/f=auto,fit=scale-down,q=85,metadata=none,w=600,h=600/app/images/products/sliding_image/491635c.jpg | https://cdn.grofers.com/cdn-cgi/image/f=auto,fit=scale-down,q=85,metadata=none,w=600,h=600/app/images/products/sliding_image/491635d.jpg | https://cdn.grofers.com/cdn-cgi/image/f=auto,fit=scale-down,q=85,metadata=none,w=600,h=600/app/images/products/sliding_image/491635e.jpg | https://cdn.grofers.com/cdn-cgi/image/f=auto,fit=scale-down,q=85,metadata=none,w=600,h=600/app/images/products/sliding_image/491635f.jpg | https://cdn.grofers.com/cdn-cgi/image/f=auto,fit=scale-down,q=85,metadata=none,w=600,h=600/app/images/products/sliding_image/491635g.jpg | https://cdn.grofers.com/cdn-cgi/image/f=auto,fit=scale-down,q=85,metadata=none,w=600,h=600/app/images/products/sliding_image/491635h.jpg | https://cdn.grofers.com/cdn-cgi/image/f=auto,fit=scale-down,q=85,metadata=none,w=600,h=600/app/images/products/sliding_image/491635i.jpg | https://cdn.grofers.com/cdn-cgi/image/f=auto,fit=scale-down,q=85,metadata=none,w=600,h=600/app/images/products/common/customer_care.jpg","[{'Key Features': 'Gluten free.Transfat free.Non GMO.No added MSG.'}, {'Offer': 'Pack of 2'}, {'Unit': '2 x 150 g'}, {'Shelf Life': '8 months'}, {'Customer Care Details': 'Email: info@blinkit.com'}, {'Return Policy': 'This Item is non-returnable. For a damaged, defective, incorrect or expired item, you can request a replacement within 72 hours of delivery. In case of an incorrect item, you may raise a replacement or return request only if the item is sealed/ unopened/ unused and in original condition.'}, {'Expiry Date': 'Please refer to the packaging of the product for expiry date.'}]",,bf637db8-f93b-5524-acb8-ad85097fff0c,19/11/2023 18:13:26
https://blinkit.com/prn/gatorade-blue-bolt-flavour-sports-drink/prid/377,Gatorade Blue Bolt Flavour Sports Drink,Gatorade,377,"Gatorade is a scientifically formulated sports drink with fluids, electrolytes (mineral salts), carbohydrates and flavor, that helps you to Rehydrate, Replenish and Refuel. It helps to restore fluids, Electrolytes and energy-that you lose in sweat during exercise.",50,INR,InStock,blinkit.com,377,"https://cdn.grofers.com/cdn-cgi/image/f=auto,fit=scale-down,q=85,metadata=none,w=600,h=600/app/images/products/full_screen/pro_377.jpg?ts=1697204030 | https://cdn.grofers.com/cdn-cgi/image/f=auto,fit=scale-down,q=85,metadata=none,w=600,h=600/app/images/products/sliding_image/377a.jpg?ts=1697204030 | https://cdn.grofers.com/cdn-cgi/image/f=auto,fit=scale-down,q=85,metadata=none,w=600,h=600/app/images/products/sliding_image/377b.jpg?ts=1697204030 | https://cdn.grofers.com/cdn-cgi/image/f=auto,fit=scale-down,q=85,metadata=none,w=600,h=600/app/images/products/sliding_image/377c.jpg?ts=1697204030 | https://cdn.grofers.com/cdn-cgi/image/f=auto,fit=scale-down,q=85,metadata=none,w=600,h=600/app/images/products/sliding_image/377d.jpg?ts=1697204030 | https://cdn.grofers.com/cdn-cgi/image/f=auto,fit=scale-down,q=85,metadata=none,w=600,h=600/app/images/products/sliding_image/377e.jpg?ts=1697204030 | https://cdn.grofers.com/cdn-cgi/image/f=auto,fit=scale-down,q=85,metadata=none,w=600,h=600/app/images/products/sliding_image/377f.jpg?ts=1697204030 | https://cdn.grofers.com/cdn-cgi/image/f=auto,fit=scale-down,q=85,metadata=none,w=600,h=600/app/images/products/sliding_image/377g.jpg?ts=1697204030 | https://cdn.grofers.com/cdn-cgi/image/f=auto,fit=scale-down,q=85,metadata=none,w=600,h=600/app/images/products/sliding_image/377h.jpg?ts=1697204030 | https://cdn.grofers.com/cdn-cgi/image/f=auto,fit=scale-down,q=85,metadata=none,w=600,h=600/app/images/products/common/customer_care.jpg","[{'Key Features': 'Featured with carbohydrates which give you energy when you exerciseHelp replace lost electrolytes and fluidsHelps you to rehydrate, replenish and refuel'}, {'Ingredients': 'Water, Sugar, Dextrose, Acidity Regulator (330), Mineral Salts, Flavour Emulsion (Flavouring Substances, Stabilizer (414), Colour (133)), Stabilizer  (444)'}, {'Unit': '500 ml'}, {'Packaging Type': 'Bottle'}, {'Flavour': 'Blue Bolt'}, {'Shelf Life': '6 months'}, {'Manufacturer Details': 'Varun Beverages Pvt. Ltd.'}, {'Marketed By': 'PepsiCo India Pvt. Ltd.'}, {'FSSAI License': '10012022000088'}, {'Country of Origin': 'India'}, {'Customer Care Details': 'Email: info@blinkit.com'}, {'Expiry Date': 'Please refer to the packaging of the product for expiry date.'}, {'Seller': 'Bigway Marketing Private Limited'}, {'Seller FSSAI': '13323999000312'}, {'Description': 'Gatorade is a scientifically formulated sports drink with fluids, electrolytes (mineral salts), carbohydrates and flavor, that helps you to Rehydrate, Replenish and Refuel. It helps to restore fluids, Electrolytes and energy-that you lose in sweat during exercise.'}, {'Disclaimer': 'Every effort is made to maintain the accuracy of all information. However, actual product packaging and materials may contain more and/or different information. It is recommended not to solely rely on the information presented.'}]",Energy Drinks,e43ad712-5f73-5f1e-afbb-fa1371e30d9c,19/11/2023 18:13:40
https://blinkit.com/prn/bare-anatomy-anti-hair-fall-hair-serum/prid/512385,Bare Anatomy Anti-Hair Fall Hair Serum,Bare Anatomy,512385,Buy Bare Anatomy Anti-Hair Fall Hair Serum online in India at lowest price and get super fast home delivery with easy returns. Available in  50 ml,330,INR,OutOfStock,blinkit.com,512385,"https://cdn.grofers.com/cdn-cgi/image/f=auto,fit=scale-down,q=85,metadata=none,w=600,h=600/app/images/products/full_screen/pro_512385.jpg?ts=1685984469 | https://cdn.grofers.com/cdn-cgi/image/f=auto,fit=scale-down,q=85,metadata=none,w=600,h=600/app/images/products/sliding_image/512385a.jpg?ts=1690830814 | https://cdn.grofers.com/cdn-cgi/image/f=auto,fit=scale-down,q=85,metadata=none,w=600,h=600/app/images/products/sliding_image/512385b.jpg?ts=1690830814 | https://cdn.grofers.com/cdn-cgi/image/f=auto,fit=scale-down,q=85,metadata=none,w=600,h=600/app/images/products/sliding_image/512385c.jpg?ts=1690830814 | https://cdn.grofers.com/cdn-cgi/image/f=auto,fit=scale-down,q=85,metadata=none,w=600,h=600/app/images/products/sliding_image/512385d.jpg?ts=1690830814 | https://cdn.grofers.com/cdn-cgi/image/f=auto,fit=scale-down,q=85,metadata=none,w=600,h=600/app/images/products/sliding_image/512385e.jpg?ts=1690830814 | https://cdn.grofers.com/cdn-cgi/image/f=auto,fit=scale-down,q=85,metadata=none,w=600,h=600/app/images/products/common/customer_care.jpg","[{'Shelf Life': '18 months'}, {'Manufacturer Details': 'Onesto Labs Private Limited, Plot No. 592 Udyog Vihar, Phase 5, Gurugram Haryana India 122016'}, {'Marketed By': 'Onesto Labs Private Limited, Plot No. 592 Udyog Vihar, Phase 5, Gurugram Haryana India 122016'}, {'Country of Origin': 'India'}, {'Customer Care Details': 'Email: info@blinkit.com'}, {'Return Policy': 'You may replace this item within 72 hours of buying if in case it is found faulty, damaged or incorrect. After 72 hours, kindly contact the brand service centre. In case of an incorrect item, you may raise a replacement request only if the item is sealed/ unopened/ unused and in original condition.'}, {'Disclaimer': 'Every effort is made to maintain accuracy of all information. However, actual product packaging and materials may contain more and/or different information. The color of the product displayed in the image may differ from that received in the order. It is recommended not to solely rely on the details presented.'}]",Hair Care & Styling,46e49d7e-ca43-5874-ac7f-2425a9630136,19/11/2023 18:13:40
https://blinkit.com/prn/demon-dentist/prid/509781,Demon Dentist,,509781,Buy Demon Dentist online in India at lowest price and get super fast home delivery with easy returns. Available in  1 piece,1,INR,OutOfStock,blinkit.com,509781,"https://cdn.grofers.com/cdn-cgi/image/f=auto,fit=scale-down,q=85,metadata=none,w=600,h=600/app/images/products/full_screen/pro_509781.jpg?ts=1685975704 | https://cdn.grofers.com/cdn-cgi/image/f=auto,fit=scale-down,q=85,metadata=none,w=600,h=600/app/images/products/sliding_image/509781a.jpg?ts=1690830294 | https://cdn.grofers.com/cdn-cgi/image/f=auto,fit=scale-down,q=85,metadata=none,w=600,h=600/app/images/products/sliding_image/509781b.jpg?ts=1690830294 | https://cdn.grofers.com/cdn-cgi/image/f=auto,fit=scale-down,q=85,metadata=none,w=600,h=600/app/images/products/common/customer_care.jpg","[{'David Walliams': 'Author'}, {""Children's Story Books"": 'Genre'}, {'4.16': 'Rating'}, {'Paperback': 'Binding'}, {'English': 'Language'}, {'Publisher': 'Harper Collins Publishers India ltd'}, {'Pages': '448'}, {'Dimensions (cm)': '13 x 3.4 x 19.7'}, {'Unit': '1 piece'}, {'Publication Date': '2015/02/12'}, {'ISBN-13': '9780007453580'}, {'Country of Origin': 'United Kingdom'}, {'Customer Care Details': 'Email: info@blinkit.com'}, {'Return Policy': 'You may return this item within 24 hours of buying it in case it is damaged or defective, or you have received an incorrect item.'}, {'Description': 'The latest jaw-achingly funny, number-one bestselling novel from David Walliams - now out in paperback. Make your appointment if you dare…Darkness had come to the town. Strange things were happening in the dead of night. Children would put a tooth under their pillow for the tooth fairy, but in the morning they would wake up to find… a dead slug; a live spider; hundreds of earwigs creeping and crawling beneath their pillow. Evil was at work. But who or what was behind it…?Read this book and find out!'}, {'Disclaimer': 'Every effort is made to maintain the accuracy of all information. However, actual product packaging and materials may contain more and/or different information. The color of the product displayed in the image may differ from that received in the order. It is recommended not to solely rely on the details presented.'}]",,2ed301c6-15c4-5484-a9cf-7080e8cf9ccb,19/11/2023 18:13:41
